Yazar,Ay,Sene,Baslik,Cumle
Huseyin Suekinci,3,2025,Beyaz önlüklüler,"‘1915 yılında Tıbbiye'ye kaydolan 1. sınıf öğrencilerinin tamamı Çanakkale'de şehit düştü ve bu nedenle de Mekteb-i Tıbbiye-i Şahane 1921 yılında hiç mezun veremedi.’
Türkiye’deki tıp fakültelerinde yaklaşık 20 yıldır müfredatta olan bir ders var.
‘Simüle / Standardize Hasta Uygulamaları.’
İstanbul Üniversitesi İstanbul Tıp Fakültesi’nde de 2008’den beri bu eğitim öğrencilere veriliyor.
Tıp fakültesi öğrencileri, 2. sınıfta simüle hastalardan anamnez (hastanın öyküsü) alıyor ve 3. sınıfta fiziki muayene yapıyorlar.
Simüle hastalar öykü alma uygulamasında doktor adaylarına geri bildirimde bulunuyorlar.
Bütün bu süreçte görüntü kaydediliyor. Daha sonra hocalar bu görüntüleri izliyor, öğrencinin varsa eksik kaldığı yönlerin tamamlanması için geri bildirim veriyor.
Eğitimin özünde öğrencilerin iletişim becerilerini geliştirmesi amaçlanıyor.
15 yıldır, gönüllü simüle hasta olarak eğitimlere katılıyorum.
Geri bildirimin ne kadar faydalı olduğunu bu eğitimler sayesinde öğrendim.
Doktor adaylarının eğitimine, özellikle iletişim becerilerinin gelişimine müthiş önem veriliyor. Emektar hocalarımızın hepsini yürekten kutluyorum.
Özverili eğitimciler takdiri hak ediyor.
Bugünkü yazım, sağlık sektörünün tüm emekçilerine ve üzerimde hakkı olan sağlık çalışanlarına bir nevi geri bildirim niteliğinde.
DR. İBRAHİM GÖKÇE
Bugün atıyorsa kalbim, kalem tutabiliyorsa ellerim, hayata umutla bakabiliyorsam hâlâ; bunu hekimlere borçluyum.
Şubatta doğmuşum, hem de Kars’ın buz gibi şubatında. İklimlerin henüz yolunu şaşırmadığı yıllar. Sıkıntılı bir doğum olmuş. Annem günlerce komada kalmış.
Kars’ın hatta bölgenin meşhur Kadın Doğum Uzmanı Dr. İbrahim Gökçe’ye borçluyum annemin hayata tutunuşunu.
Annemi Azrail’in elinden çekip almış deyim yerindeyse.
Sayısız kadının hayatını kurtaran beyaz önlüklü bir melek…
Genç yaşta göçmüş dünyadan.
Rahmetle yad edilmeyi hak ediyor. Ruhu şad olsun.
VİTAMİN ZİYAN OLMASIN DİYE…
Bize her ne kadar X kuşağı deseler de ben kendimi ve yaşıtlarımı E kuşağı olarak nitelendiriyorum.
Demir şırıngayla iğne olmuş EFSANE nesil yani.
Ömrüm iğne yemekle geçti. Penisilini en can yakıcı olan sanıyordum, ta ki diz kapağımın zarına yapılan iğneye kadar.
Sıvı enjekte edildi bir defasında diz kapağıma. Bir süre bekledikten sonra o sıvı geri çekiliyordu. İngiltere’ye 8-0 yenildiğimizde duyduğum acıdan da derindi.
Kardeşim Uygar acayip korkardı iğneden.
Korkmakta haklıydı.
Şimdiki gibi değildi iğneler.
Kocamandı, şırıngalar demirdendi ve dakikalarca kaynatılırdı önce.
Şövalyelerin dişbudak ağacından yaptığı mızraklara benzetirdik.
Şırınganın kaynatılışını, giyotin sırasını bekleyen mahkumlar gibi çaresizce izlerdik.
İğneyi yemeden yanardı canımız.
Uygar için vitamin iğnesi yazmıştı doktor.
İmdat Amca, mahallemizin gönüllü iğnecisiydi. Para da almazdı. Aşılarımız gibi duygular da milliydi.
Hayırseverdi ama çocuklar pek sevmezdi kendisini.
Vitamin ampulünün miktarı fazlaydı Uygar için.
Ziyan olmasın diye geri kalan dozu, bir ay boyunca bana yaptı İmdat amca. Hem de aynı iğneyle.
Ziyankarlığı sevmiyordu rahmetli.
Kendimi E kuşağı olarak görmem boşuna değil.
Eli hafif, yüzü güleç hemşireler, tatlı dilli hasta bakıcılar selamı hak ediyor.,
Selam olsun hepinize.
PROF. DR. SEVİL KAMALI
En büyük hayalim futbolcu olmaktı. Yetenekliydim de. Kısmet olmadı.
Kısmet olmadı çünkü tam da lisansımın çıktığı günlerde dizimde bir şişlik.
Sonrasında yıllarca hastane hastane, doktor doktor gezdik.
Romatizmaymış meğer, gözle görülmeyen bir iltihaba yenildik.
Futbolcu olamayacağım netleşince ‘bari maçlara gideyim’ diye üniversite sınavında Gazetecilik bölümünü tercih ettim.
1996 yılında İstanbul Üniversitesi, İletişim Fakültesi, Gazetecilik bölümünü kazandım.
Üniversitedeki ilk yılımda hastalığım daha da ilerledi. Bırakın maça gitmeyi, yürüyemez, kalem tutamaz hale geliyordum ataklar sırasında.
Gitmediğimiz devlet hastanesi kalmamıştı. Teşhis konamıyordu bir türlü.
Bir gün okulda fenalaşınca ambulansla Çapa’ya yani İstanbul Tıp Fakültesi’ne götürüldüm.
‘Çözerse Sevil çözer’ dedi acildeki doktor.
Kocaman gözlüklerinin camı, şişe gibi kalındı. Sesi tam aksine incecik. Minyon tipli, lise öğrencisi görünümlü bir kızdı karşımdaki. İçimden ‘Hay şansıma, bu mu kız mı çözecekmiş’ diye geçirdim.
Mesleğine aşık bir doktorun titiz çalışması ve bir dizi testlerin ardından seronegatif artrit teşhisini koydu Sevil hoca.
Önyargılı olmayı o yıl bıraktım.
1997’de uzman doktor olan Prof. Dr. Sevil Kamalı’ya çok şey borçluyum.
Okuldan mezun olmama sayılı günler kala, rutin kontrole gitmiştim yine İstanbul Tıp Fakültesi’ne.
Şöyle bir diyalog geçti Sevil Hocayla aramızda:
“Hüseyin, okulun bittiğinde iş bulamayabilirsin, hala ayakta durmakta güçlük çekiyorsun çünkü. Tedavini lütfen ihmal etme, sağlığına tamamen kavuşacaksın. Sigortalı iş bulamazsan, sen yine bana gel, olmadı mesai bitiminden sonra yaparız muayeneni. Tahliller konusunda da yardımcı olurum.”
Dr. Sevil Kamalı, o günden sonra ‘Sevil Abla’ oldu benim için.
Meğer bütün hastaları için aynı hassasiyeti gösterirmiş, zamanla öğrendim.
Sevil abla hastalara şifa dağıtmaya devam ediyor.
Hastalarının sevgilisi adeta.
Sevilmeyi fazlasıyla hak ediyor.
DR. ZAFER TÜRKMEN
Dr. Zafer Türkmen’i şahsen tanımıyorum. İlk fırsatta ziyaret edeceğim kendisini.
Zafer hocanın adını, SÖZCÜ Gazetesi’nin yayın hayatına başladığı tarihten beri, yaptığı nitelikli sağlık haberlerinden tanıdığınız Nazan Doğaner Halıcı’dan duymuştum.
6 Şubat Depremi’nden sonra İstanbul Bahçelievler’de kurucusu olduğu göz hastanesinin depremzedelerden muayene ücreti almadığına bizzat şahit oldum.
Acı dolu o günlerde Adıyamanlı depremzede Nigar teyzenin katarakt ameliyatından ücret almadı kurum.
Pahalı da olsa benzer operasyonların depremzedelere ücretsiz yapıldığını yine Nazan Hanım’dan biliyorum.
Gönülleri fethettiler. İyiliğin zaferi bu olsa gerek.
Bu inceliği gösteren kurumlar ve şahıslar, şükranı hak ediyor.
SÖZCÜ’NÜN KAMPANYASI, ÇOCUKLARA BURS HASTALARA ŞİFA OLDU
SÖZCÜ, 2018’de bir ilke imza attı. Gazetemize verilen başsağlığı ve vefat ilanlarının gelirinin yüzde 15’ini, sivil toplum kuruluşlarına bağışlama kararı aldı. İlan gelirinin bağışlanacağı vakfı da ilanı verenler belirledi. Mayıs 2018’de başlayan “Acılar Paylaştıkça Hafifler” adlı bağış kampanyasına yüzlerce vatandaş destek verdi.
Topluma öncülük etmek saygıyı ve desteği hak ediyor.
SAĞLIKTA 2002 ÖNCESİNE DÖNDÜK
AKP,  sağlık konusunda çıkmazda.
Erdoğan doktorlar için ‘giderse gitsinler’ dedi. 20 bine yakın doktor yurt dışına gitti
Tıp fakültesi öğrencileri de yurt dışı hayali kuruyor.
Aile hekimleri, seslerini duyurabilmek için eylem üstüne eylem yapıyor.

Çocuklar geri bildirimlerini resimlerle ifade ediyorlar. Mahallemizin aile hekimi Dr. Ömür Taştemir’in muayene odasından bir kesit.
Hasta garantili şehir hastaneleri bütçenin sırtında kambura, vatandaş devletin nazarında müşteriye dönüştü.
Randevu krizi her geçen büyüyor.
Uyku polikliniğinde randevu almak istedim geçen yıl, 3 yıl sonrasına gün verdiler.
Keşke başvursaydım, 2 yılım kalmıştı şimdi.
KAPATMAKTA MAHİRİZ
Atatürk döneminde kurulan Refik Saydam Hıfzıssıhha Enstitüsü 2011 yılında kapatıldı.
Memleketin tüm aşıları, yüzde yüz yerli imkanlarla burada üretilirdi; aklınıza gelebilecek bütün her şey.
2011’den bu yana sadece aşılar için milyarlarca dolar harcıyor devlet. Pandemide şahit olduk hep birlikte.
15 Temmuz darbe girişiminin ardından Gülhane Askeri Tıp Akademisi (GATA) başta olmak üzere 32 askeri hastane kapatıldı.
2016 yılından beri askeri hastanesi bulunmayan tek NATO ülkesi Türkiye oldu.
Türkiye’nin yaklaşık 520 bin aktif askeri, 400 bine yakın da yedek askeri bulunuyor.
Ordusunda 34 bin asker barındıran Avusturya’da tam teşekküllü üç askeri hastane ve savaş cerrahisi uzmanları var.
I. Dünya Savaşı’nda tarafsızlık kararı alan, II. Dünya Savaşı’nda teslim olan Norveç’te bile askeri hastane var.
TÜRK TABİPLERİ BİRLİĞİ (TTB) KAPATILSIN!
MHP Genel Başkanı pandemi döneminde 2 kez çağrıda bulunmuştu, TTB kapatılsın diye.
‘TTB isimli bölücü yapılanma’ sözlerini kullanan Bahçeli, ‘HDP’nin yolundan giden, bölücülüğün propagandasını yapan, zillete düşen bunlardır’ bile demişti.
Bahçeli’nin ‘Cani Öcalan’ ifadesi de aynı konuşmasında geçiyor.
Siyasetçilerin en becerikli oldukları şey; 180 derece manevra kabiliyetine sahipler.
Yenidoğan Çetesi olayı patlak verdiğinde, sesi çıkmayan Bahçeli, bu süreçte Sağlık Bakanı’na sahip çıkmış, Bakan’ın istifasını isteyenlere ayar çekmiş, ahlaksızlıkla suçlamıştı.
Bahçeli’nin TTB kapatılsın çıkışı, kaba üslubu, insanlık tarihinin en değerli mesleğini icra eden doktorları incitmişti. Bu sözler, Op. Dr. Hüsrev Çetin’i de üzmüştü. Bunun üzerine ‘SİZ’ adlı şiiri yazdı.
Manifesto niteliğinde bir şiir.
Doktorların ve sağlık çalışanlarının yaşadıklarını, neler hissettiklerini o kadar naif bir dille anlatıyor ki. 
Hatta kendisinden müsaade alıp şiirini seslendirmiştim iki yıl önce. Şiirin sözlerini yazımın sonunda paylaştım sizlerle. Dileyen YouTube'den şiiri dinleyebilir.
Türk Tabipleri Birliği Türkiye’deki hekimlerin örgütlü sesi olmanın yanısıra halk sağlığını ilgilendiren konularda tutum belirleyen, raporlar hazırlayan, kısacası halkı bilinçlendiren bir kurum.
‘Bizim en büyük mutluluğumuz, bilinçli yaşamaktır’ der Merhum İlhan Selçuk.
Bilinçli vatandaş, bilinçlendiren kurumlar kimilerinin en büyük korkusu.
TTB, “14 Mart günü tüm hekimleri ve sağlık emekçilerini hastalara, çalışanlara iyilik sağlama şansı kalmamış olan mevcut sağlık sistemini ve yönetimi protesto etmek, “Başka Bir Sağlık Sistemi”ni muhataplarına ve halka anlatmak üzere G(ö)REV’e davet ediyoruz” çağrısı yaptı.
Çağrınızı yürekten destekliyorum.
Bugün sağlık emekçilerinin bayramı.
İsimlerini belirtemediğim ancak hayatıma dokunan onlarca sağlık emekçisinden özür diliyorum
Beyaz önlüklü melekler, bayramınız kutlu olsun.
 
NOT: İki kitap önerim var bu defa.
Prof. Dr. Memduh Dursun’a ait SEVGİLİ KELİMELER.
Okuduğunuzda eminim ‘Kelimelerin de ruhu varmış’ diyeceksiniz. Dursun’un kişiliğindeki zariflik, sevgili kelimelere de tesir etmiş.
Diğer önereceğim kitap İbni Sina’nın talebesi HEKİM.
Amerikalı yazar Noah Gordon’un tarihi kurgu romanı.
11. yy başında İngiltere'de bir berber-cerrahın yanına çırak olarak verilen öksüz ve yetim Rob'un ibretlik hikayesi. Kitabın 700 küsür sayfa oluşu gözünüzü korkutmasın. Hekim, bir solukta okutuyor kendini.
 
SİZ
Siz hiç, bir insanın içini gördünüz mü?
Canlıyken, kalbi atarken!
Damarlarında kanı dolaşırken!
Bir de içinde bir dert aradınız mı?
Ben aradım!
Siz kanser olduğunu bir insanın,
Daha kendi bilmeden.
En yakını, en çok seveni duymadan!
Teşhisini koyup ağladınız mı?
Ben ağladım.
Siz hiç, kanayan yaraya el bastınız mı?
Düşünmeden bir şey bulaşır mı diye!
Açık yaraya dibinden baktınız mı?
Gözünüze sıçrayan kandan, hepatit kaptınız mı?
Ben kaptım.
Siz hiçbir tümör gördünüz mü?
Dokuz yaşında bir çocuğun kafasının içinde,
Görünce anlayıp yakın olan ölümünü,
Ve bunu annesine nasıl söyleyeceğinizi düşündünüz mü?
Ben düşündüm.
Siz hiç başınız sağolsun dediniz mi?
Hastayı ne halde getirdiklerini unutup!
Kapıda umutla bekleyen kalabalığa.
Bir babaya, bir anaya, bir evlada!
Ben dedim.
Siz hiç bir gece vakti, kalkıp sıcak yatağınızdan,
Polisle, jandarmayla uzun yol gidip,
Kör bir bir ışıkla vadiden indiniz mi?
Üstelik, bile bile az sonra görülecek manzarayı.
Ben indim.
Yetmez gibi gecenin sersemliği,
Ters dönmüş araçtan, cesetler çıkarıp,
Niye ölmüş diye soran savcıya,
Bir sebep söylediniz mi hiç!
Ben söyledim.
Siz uyurken sabaha karşı,
Çalan bir telefonla uyanıp,
Ya yetişemezsem diye, gaza basıp,
Apar topar ameliyata girdiniz mi?
Ben girdim.
Siz bir akşam misafir ağırlarken,
Ya da, güzel bir yemekteyken,
Belki de en sevdiğiniz dizi oynarken,
Koşa koşa hastaneye gittiniz mi!
Tanımadığınız biri için?
Ben gittim.
Ben daha neler yaşadım,
İnsana, insanlığa, yaşama dair.
Ne gerekiyorsa yapınla başlayan,
Terk etmeler, vefasızlıklar gördüm.
Siz gördünüz mü?
Siz hiç bir salgında,
Bulaşmasın diye evine kaçarken herkes,
Ateşli, halsiz, deva bekleyen birini,
Yatırıp yanınıza, tedavi ettiniz mi?
Ben ettim,
Ve sırf bu yüzden,
Herkes korkarken hasta olmaktan,
Siz hasta oldunuz mu?
Bırakın hastalığı, öldünüz mü?
Ben öldüm!
Normal bir insansanız eğer,
Herkes kalan giden, sayılara bakarken,
Bir can için, kendini feda eden kardeşlerinizi,
Görürken ölüme meydan okuyan meslektaşlarınızı!
Ses vermez miydiniz?
Ben veriyorum.
Artık, Kimse demesin bana!
Otur oturduğun yerde!
Bir de birlik olmuşsunuz,
Çok ses veriyorsunuz, susturamıyoruz böyle!
Ve, sakın demeyin bana!
Senin sesin çok çıkıyor, bırak canları!
Benim iktidarım gidiyor burda!
Kapatılsın hemen, tabip odaları!
Ben seçmişim zaten yolumu, gerekirse ölürüm.
Benim derdim, kendim değil diyorum.
Her bir insan hayatı değerli; bilin istiyorum.
Hiçbir can, önlem alınmadığı için gitsin istemiyorum.
Op. Dr. Hüsrev Çetin"
Huseyin Suekinci,3,2025,Saygı bulaşıcıdır,"‘Dünyada olabilecek her bir olay için misal aleminde sayısız ihtimal uyur. Siz ağzınızdan çıkardığınız sözlerle o ihtimalleri uyandırırsınız. Güzel kelimeler söyleyin ki güzel ihtimaller uyansın. İnsanın kaderine müdahalesi buradadır.’ Mevlânâ Celâleddîn-i Rûmî
Avrupa Kupalarında ülkemizi temsil eden tek takım Fenerbahçe.
Temsilcimiz bu akşam Avrupa Ligi son 16 Turu’nda İskoçya’nın köklü takımlarından Glasgow Rangers’i ağırlayacak.
153 yıllık geçmişi olan İskoç ekibinin, bu turnuvada 2007-2008 ve 2021-2022 sezonlarında final oynadığını hatırlatayım.
Grup aşamasında 14 puan toplayan Rangers, averajla turnuvayı 8. sırada tamamladı ve doğrudan son 16’ya yükseldi.
İki ekip en son 2001-2002 sezonunda UEFA Şampiyonlar Ligi elemelerinde rakip oldu. Temsilcimiz, deplasmanda golsüz berabere kaldığı rakibini Kadıköy’de 2-1’lik skorla yenmişti.
Tarihin tekerrür etmesi en büyük dileğimiz. 18 maçtır yenilmeyen Fenerbahçe, İskoç ekibini eleyecek güce sahip.
‘Saygı bulaşıcıdır’ başlığı için ‘Ne alaka’ diyebilirsiniz haklı olarak.
Şöyle;
SAYGI DUYDUM
Rangers Kulübü Fenerbahçe ile eşleştikten sonra bir bildiri yayınladı.
Bildiride, bugün oynanacak karşılaşmanın Ramazan ayına denk geldiği hatırlatılarak ‘Bu durum, seyahat eden taraftarlarımızı önemli ölçüde etkilemese de lütfen ülkenin örf ve adetlerine saygılı olun. Gündüz saatlerinde halka açık yerlerde yemek yemekten, içki ve sigara içmekten ya da sakız çiğnemekten kaçının. Barlar ve restoranlar açık olacaktır. Halka açık alanlarda yüksek sesle müzik dinlemekten, dans etmekten ve küfür etmekten kaçının.’ ifadelerine yer verildi.
Taraftarlardan ziyaretleri boyunca gelenek ve yasalara saygı göstermeleri rica edildi.
Bu başlığı atmama sebep oldu İskoç ekibinin yayınladığı bildiri.
Saygı duydum.
Saygı çok güçlü bir kavram.
Sevgi, aşktan büyüktür derler. Tartışılır. Ancak her ikisi de fanidir. Saygı ise ebedidir.
SAYGININ YAŞI YOK
Yıllar önce U14 Gelişim Ligi'nde Galatasaray’la İstanbulspor arasında oynanan maç geldi aklıma.
Beknaz Almazbekov. Kırgız futbolcu, ceza sahası içerisinde ikili mücadelede kendini yerde buldu. Maçın hakemi penaltı noktasını gösterince Beknaz hakeme ‘penaltı değildi’ itirazında bulunsa da hakem kararından vazgeçmedi.
Hatta penaltıyı kullanmadan hemen önce son bir kez daha denedi şansını minik futbolcu, sonuç yine değişmedi.
Ne yaptı peki Beknaz? Topu dışarı attı. Metin Oktay’ın ruhunu şad etti adeta.
Spor severlerin saygısını kazanmanın yanı başında.
ŞAMPİYONLUKTAN DAHA DEĞERLİ
Daha eskilere gidelim.
Muhammed Ali Raşvan.
Mısırlı judocu.
Muhammed Ali, ülkesini 1984’te ABD Los Angeles yaz olimpiyatlarında judoda temsil etti.
Finalde rakibi Japon Yasuhiro Yamashita ile karşılaştı. Yamashita müsabakalar sırasında sağ ayağının kasları yırtıldığı için final karşılaşmasına yaralı olarak çıkmak zorunda kaldı. Mısırlı sporcu için kolay bir final olacaktı.
Müsabaka sırasında Muhammed Ali’nin antrenörü kenardan sürekli haykırıyordu: Sağ bacağına vur!
Muhammed’in rakibinin sağ ayağına bir defa vurması yetecekti. Fakat yapmadı. Yenildi ve gümüş madalya ile yetindi.
Müsabakadan sonra etrafını saran bütün gazetecilerin sorusu aynıydı: Neden yapmadın?
Cevap saygı duyulacak cinstendi: Benim inancım insana zarar vermeyi yasaklar. Eğer o durumdayken yüklenip oraya vursaydım, ömür boyu engelli kalabilirdi. Bir madalya için bunu ona yapamazdım.
Gönüllerin şampiyonu olmayı tercih etmişti.
Muhammed Ali Raşvan’ın bu tavrı ayakta alkışlandı ve Uluslararası Fairplay Komitesi onu ‘1984 Fairplay Ödülüne’ layık gördü.
Örnekleri çoğaltmak mümkün.
Bugün umarım Fenerbahçe güzel bir skorla sahadan ayrılır.
Ve umarım gerek yeşil sahada gerekse tribünlerde saygı duyulacak anlara şahit oluruz.
İskoç ekibi bu saygıyı kesinlikle hak ediyor.
Türkiye’de spor iklimi sıkıntılı bir süreçten geçiyor. Bu süreci olumsuz etkileyen birçok etken var.
Sporun paydaşlarına düşen vazife, öncelikle saygı ortamını tesis etmek.
Gerisi çorap söküğü gibi gelir.
Yazıma Mevlana'nın sözleriyle neden mi başladım?
Güzel ihtimalleri uyandırma çabası diyelim...
Not:
Bir film önereceğim bu kez sizlere.
Filmin adı: Yom el-Din / Yomeddine / Judgement Day / Kıyamet Günü (Hesap Günü)
Cüzzam geçirmiş ve görünüşü nedeniyle dışlanan ve ucube muamelesi gören bir adam, kimsesiz bir çocuk ve beyaz bir eşek ile başlayan bir yol hikayesi.
İnsanın yüreğini burkan sert bir gerçekçilikle kabullenişin ve hayata dair umudun bitmediği bir tebessüm arasında gidip geliyor 2018 yapımı film.
İşlediği sımsıcak dostluk hikâyesiyle, izleyenleri gülümsetmeyi başaran mizah anlayışıyla, yüreklere dokunuyor adeta. Alışık olmadığımız bir coğrafyadan, alışık olmadığımız kahramanları ve hikâyesi ile son derece etkileyici bir yapıt Hesap Günü.  
Saygı demiştim ya hani kimliklere saygı, inançlara saygı, tercihlere saygı...
Film ötekileştirmenin ve bunun sonucunda birbirine yabancılaşmanın getirdiği daha doğrusu getiremediği ‘Saygı’ kavramını irdeliyor.
Saygı duymuyorsan ötekileştirirsin…"
Huseyin Suekinci,3,2025,Taraftarların da umut hakkı olmalı,"Türkiye Spor Yazarları Derneği (TSYD) Turnuvası’nda 3 büyükler sezon öncesi karşılaşırdı eskiden.
Okullar kapalı olduğundan Anadolu’da yaşayan çocuklar için de büyük bir fırsattı bu durum.
Turnuvaya 2000 yılından beri 3 büyükler katılmıyor maalesef.
Derslerimin iyi olmasının ödülü olarak İstanbul’a abimin yanına gitmiştim.
90’lı yılların başı.
Yanlış hatırlamıyorsam turnuvanın ilk maçı Galatasaray’la Beşiktaş arasında oynanmıştı.
O maçı kaçırsam da Oktay abim Galatasaray - Fenerbahçe derbisine götürmüştü beni.
Seyrettiğim ilk derbiydi.
Roman Kosecki, Fenerbahçe savunmasını perperişan etmiş, maçı Galatasaray 2-1 kazanmıştı.
Benim açımdan, İstanbul Boğazı’ndan geçerken denizin maviliğini ilk kez görmek kadar heyecan vericiydi derbi.
Küfür de yoktu üstelik.
Aklımda kalan, taraftarların ayakkabılarından birini çıkarıp havaya salladıkları ve ‘Dışarda dayak var’ tezahüratıydı…
Fenerbahçe – Beşiktaş maçına da götürecekti abim ancak kuzenim Recep’in sünnet düğünü varmış.
Hal böyle olunca ‘Maça gidemeyiz’ dedi abim.
İki gözüm iki çeşme ağladığımı çok net hatırlıyorum.
Malum, ağlamayana meme yok.
Rahmetli amcam ‘Niye ağlatıyorsunuz yeğenimi’ diye sorunca abim konuyu anlattı.
‘Söz verdiysen maça gidecek’ deyip meseleyi kestirip attı, o andan itibaren en sevdiğim polis oldu Niyazi amcam.
İstanbul’a geleli bir hafta bile olmamıştı. Hiçbir yeri bilmiyordum doğal olarak. Amcam ‘Yeğenime güveniyorum, maça tek başına gidebilir’ deyince dünyalar benim olmuştu.
13 yaşında, tek başıma, hem de bir derbi maçına gitmiş oldum böylelikle. İnsanlık için küçük benim için büyük bir olaydı.
Hayalim gerçek olmuş, üç büyüklerin 3’ünü de izlemeyi başarmıştım.
Neden nostaljik bir girişle başladım yazıya, anlatayım.
MAÇA GİTMEK LÜKS OLDU
Türkiye’de her taraftar, tuttuğu takımın maçına gidebilmeli. Benim gibi, aradan 35 yıl geçse de unutamayacağı anıları olmalı.
Halkın takımıyız iddiasındaki kulüpler, bu noktada çözüm üretmeli.
Günümüzde maçlara gitmek, hele ki çoluk çocukla birlikte gitmek ciddi bir ekonomik külfet.
Bu konuda dertli olan taraftarların sesi olmak istedim.
Halil Yıldırım. Klima teknisyeni. Sıkı bir Fenerbahçeli. Çınar (12) ve Doruk (8) adında yakışıklı iki erkek evladı var.
Yıldırım ailesiyle, Fenerbahçe - Anderlecht ve Fenerbahçe - Kasımpaşa maçları öncesi, Yoğurtçu Parkı’nda buluştum.
Taraftarların yaşadığı sorunları konuştuk.

Çınar Fenerbahçe’nin son şampiyonluğunu hatırlamıyor doğal olarak, Doruk’un yaşı bile yetmiyor.
Ama nasıl coşkulular. Onlardaki coşkuyu gören, Fenerbahçe’nin her yıl şampiyon olduğunu düşünür.
O derece…
Çınar skordan bağımsız, son ana kadar tezahürat yapan minik bir taraftar. Maçta sesi kısılmayanın taraftar kabul edilmediği yıllarda doğmuş gibi.
Aynı zamanda Kadıköy esnafı tarafından tanınan, maç öncesi stat çevresinde tek başına volta atacak kadar özgüveni gelişmiş bir çocuk.
3 yıl önce bir maç sonu Fenerbahçe Başkanı Ali Koç’la karşılaşmış ve fotoğraf çekilmiş Çınar. Hâlâ onun havasını atıyor yeri geldiğinde.
Dersleri on numara. Notlar iyiyse maça gitmeye izin çıkıyor ve 4 yıldır kaçırdığı maç sayısı çok az.
Doruk’a gelince. Daha yeni yeni ısınıyor tribün atmosferine. Maçların 2. yarısında uyuya kalıyor genelde.
BİLET FİYATLARI EL YAKIYOR
Halil önemli tespitlerde bulundu.
Fenerbahçe’den örnekler verdi, diğer kulüplerde de durum aşağı yukarı aynı.
En ucuz kombine fiyatı, kale arkası 15 bin TL.
Türkiye Kupası maçlarında en ucuz bilet 600 TL, Süper Lig maçlarında 900, Avrupa Kupası’nda 1.500 TL.
Bu arada Passolig yenileme ücreti 500 TL, yeni alıcılar kart ücreti için ekstra 129 TL ödüyor.
Stada yiyecek içecek sokmak yasak.

Bir kişinin yeme içme maliyeti minimum 500 TL'yi buluyor.
Çay 50 TL, ayran, kola 80 TL, köfte ekmek 270 TL.
Ramazan ayındayız. Yemek harcamaları doğal olarak daha da artacaktır.
Buna yol masrafı da eklenince Halil Yıldırım’ın bütçesi kevgire dönüyor.
TARAFTAR KÜSTÜRÜLMEMELİ
Özellikle kale arkası taraftarını küstürmemeli kulüpler.
Onlar gerçek 12 numara, beyaz yakalı müşteri değil.
Yağmurda, çamurda, dondurucu soğukta, gönül verdikleri takımların en büyük itici gücü.
Şu vurguyu yaptı Halil;
‘Türkiye Kupası maçlarına ilgi düşük. En azından bu maçlarda fiyatlar düşürülse stat ful çeker.’ Haklıydı.
Fenerbahçe - Erzurumspor maçında Saracoğlu Stadı’nın sadece 5’te biri doluydu.

Fenerbahçe Erzurumspor maçında tribünler boş kaldı.
Gaziantep’te oynanan Gaziantep - Fenerbahçe maçında da tribünler boştu.
Eskiden 3 büyüklerin oynadığı maçlara, taraftarlar komşu illerden bile akın ederdi.
Beşiktaş ve Galatasaray’ın Türkiye Kupası maçları da boş tribünlere karşı oynandı.
Karadeniz derbisinde Trabzonspor - Rizespor maçında bile durum farksızdı.
Halil, Avrupa Ligi’nde Beşiktaş’ın Atletic Bilbao maçında bilet fiyatlarını düşürdüğünü hatırlattı. Dolu tribünlerin neticesini, güçlü rakibi karşısında 4-1’lik tarihi galibiyetle taçlandırdı Beşiktaş.
Bitireyim;
Konuşulacak şey çok da arife tarif gerekmez.
Son günlerin moda kelimesi umut hakkı. Futbolla yatıp futbolla kalkan memlekette garibanların da çocuklarıyla maça gitmeye umudu olsun.
Boş tribünlerle değil, coşkulu taraftarla daha keyifli oluyor maçlar.
Rahmetli babamla maça gitmek nasip olmadı.
2025 ‘Aile Yılı’ ilan edildi.
Dilerim sözde kalmaz.
Ve dilerim artık dar gelirli babalar da çocuklarıyla maça, tiyatroya, sinemaya gidebilirler...
Hayırlı Ramazanlar..."
