Yazar,Ay,Sene,Baslik,Cumle
Huseyin Suekinci,2,2025,Alzheimer olan toplum...,"Acı duyabiliyorsan, canlısın. Başkalarının acısını duyabiliyorsan, insansın… (Tolstoy)
Beyin hücrelerinin zamanla ölümüne bağlı olarak hafıza kaybı, bunama (demans) olarak tarif ediliyor Alzheimer. Hastalığın daha ileri evrelerinde ise hastalar temel ihtiyaçlarını karşılamakta zorlanarak bakıma muhtaç duruma geliyor. Beni en çok ürküten hastalık.
Neden bu konuya değindim?
İzah edeyim.
6 Şubat depreminin üzerinden tam 2 yıl geçti. Ne yaralar tam anlamıyla sarılabildi ne de bölgede hayat normale dönebildi. 650 binden fazla yurttaşımız hala konteynerlerde yaşıyor.
Yaşanan onca acıdan ders çıkarmadığımızın yüzlerce örneğiyle dolu 6 Şubat felaketi. 17 Ağustos depreminden yeterince ders çıkarsak 6 Şubat’ta bu kadar yıkım yaşamayacağımız muhakkaktı.
Sanatta, sporda, eğitimde, bilimde, siyaset biliminde patinaj çekiyoruz. Arpa boyu yol alamıyorsak, hatta gün geçtikçe geriye gidiyorsak, önemli bir faktördür toplumun balık hafızalı oluşu.
Hal böyle olunca birileri; birilerine bir şeyleri kolayca yutturabiliyor her seferinde.
Bu kısır döngüden kurtulamazsak, çekilen acılar katlanarak sürüp gidecek.
Hadi gelin biraz hafızamızı yoklayalım. Benim hatırladıklarım, sizlerin unuttuğu başka konuları çağrıştırır belki de.
NELERİ UNUTMADIK Kİ
17 Ağustos depreminin sembol müteahhidi Veli Göçer’in sadece 7,5 yıl hapis yattıktan sonra tahliye edilmesini unuttuk. Geleceğin Veli Göçerlerini yüreklendirdik.
Dürüstlüğün kıymetini unuttuk. Defalarca yalan söylediğine şahit olduğumuz siyasetçileri seçmeye devam ettik.
Sahte diplomalıları unuttuk, Merhum Kemal Sunal’ın Doktor Civanım filminin gerçek oluşuna şahit olduk.
Akla ilk kimin geldiği hepimizin malumu da olsa da spordan örnek vereyim.
Asrın güreşçisi Hamza Yerlikaya. Lise diplomasının sahte olduğu mahkemede tescillendi. Mahkeme bu kararı verdiğinde Yerlikaya’nın titrinde, Cumhurbaşkanı Başdanışmanı, Gençlik ve Spor Bakan Yardımcısı, Vakıfbank Yönetim Kurulu Başkan Yardımcısı, eski AKP milletvekili ifadeleri geçiyordu. Hala Bakan Yardımcısı.
Gençlik ve Spor Bakanlığı’nın sitesinde aynen şu ifadeler geçiyor: “Süleyman Demirel Üniversitesi Burdur Eğitim Fakültesi Beden Eğitimi ve Spor Bölümünden mezun olan Yerlikaya, Sakarya Üniversitesi Yüksek Lisans eğitimini tamamladı.” Rektörlüğe kadar yolu var, yaşı müsait.
İşin bir ilginç yanı da şu. Hamza Yerlikaya, Gazi Üniversitesi Beden Eğitimi ve Spor Yüksekokulu’na kayıt yaptırmış daha önce. Ancak sonraki yıllarda Hamza Yerlikaya’nın biyografilerinde Gazi Üniversitesi mezuniyeti adeta “Buhar” olmuş…
Hasılı 4 yerden birden maaş alanları unuttuk, liyakati ehli olmamaları yanı başında.
Erzurum’da, milyonlarca lira harcanarak yapılan Türkiye’nin ilk kayakla atlama kulelerinin yıkılışını unuttuk.
Pistin çökmesiyle yıkılan sadece kuleler değildi, Erzurum’un ‘kış oyunları merkezi’ olma hayali de yıkıldı. Erzurum’da çöken atlama kulelerini yapan firmanın sahibinden hesap sorulmadığı gibi, bol sıfırlı başka ihalelerle ödüllendirildiğini unuttuk.
VİCDANLAR YARALANDI YİNE DE UNUTTUK
- 3 yıl boyunca cinsel istismara maruz bırakılan yavrularımızın travmalarını unuttuk. Olayın vuku bulduğu vakfı, dönemin Aile ve Sosyal Politikalar Bakanı Sema Ramazanoğlu. ‘Bir kereden bir şey olmaz’ mealinde sözleriyle aklamaya çalıştı. ‘Bir kere rastlanmış olması, hizmetleriyle ön plana çıkmış bir kurumumuzu karalamak için gerekçe olamaz. Biz Ensar Vakfı’nı tanıyoruz, hizmetlerini taktir ediyoruz’ (virgülüne bile dokunmadım) sözlerinin, vicdanlarda açtığı yarayı unuttuk.
- Kabataş Yalanı diye tarihteki yerini alan, iftirayı unuttuk. ‘Elimizde görüntüler var’ yalanını, olmayan görüntüleri izlediğini söyleyen gazetecileri, siyasetçileri unuttuk.
12 yıl sonra Savcılık medyaya yönelik soruşturmayı derinleştirdi malum. Savcılık, RTÜK'ten dönemin medya kayıtlarını talep etti. Hazır konu gündemdeyken, Kabataş Yalanı da yeniden gündeme gelse fena olmaz mı?
İSTİFA KÜLTÜRÜ
- Resmi rakamlara göre 301 madencinin hayatını kaybettiği Soma faciasını unuttuk.
- Soma faciasından sonra eylem yapan maden işçisini yerde tekmeleyen ve ""Ayağım incindi"" diyerek rapor alan Yusuf Yerkel’i unuttuk. Frankfurt'a 'Ticari Ateşe' olarak atanmasını demiyorum bile.
- Sezgin Baran Korkmazları, ondan avanta koparmaya çalışan mesleğin yüz karası gazetecileri unuttuk.
- Reza Zarrabları, ayakkabı kutularını, Zarrab için ‘Hayırsever işadamıdır’ diyenleri unuttuk. Amerika’daki  “İran'a yaptırımları yasa dışı yollarla delme"" davasında, Türkiye’de kimlere rüşvet verdiğini tek tek itiraf edince, çark edenleri unuttuk.
- Fenerbahçe takımının aracına yapılan silahlı saldırıyı unuttuk. Fail ya da failleri hala meçhul. 5 farklı kıtadan futbolcunun bulunduğu o otobüs ya şarampole yuvarlansaydı…
- Mafyözlüğe özenen kulüp başkanlarını, teknik direktörleri, futbolcuları unuttuk. Aklınıza onlarca isim geldiğinden eminim.
- Fatih Terim fonu diye adlandırılan dolandırıcılık davasının başrol oyuncusu Seçil Erzan’ı unuttuk.
- Milyonlarca avro kazanmalarına rağmen daha fazla kazanmak isteyen ve bu yüzden hırslarının esiri olan futbolcuları unuttuk. Para hırsının yaşı, makamı yokmuş meğer. ‘Fatih Terim, bu olaylar unutulsun diye önce Yunanistan’da şimdilerde Suudi Arabistan’da takım çalıştırıyor’ diyenlerle ‘Ya zaten unutulur giderdi’ diyenlere şahit oluyoruz.
- Vergisini kuruşu kuruşuna veren spor kulüplerinin değil de vergi kaçıran kulüplerin el üstünde tutulduğunu unuttuk.
- Yasa dışı bahis reklamı alan kulübü, ‘uygundur’ yazısı veren TFF’yi unuttuk.
- Meclis koridorunda, tribünde cinayet işlendi, unuttuk.
- Narin Cinayeti, Yenidoğan Çetesi’nin sebep olduğu bebek ölümleri, Kartalkaya Faciası. Yüzlerce örnek sıralarım. Bir, iki demiyorum bakın, bir yetkili bile istifa etmedi bu memlekette. İstifa kültürünü unuttuk.
- Seçim meydanlarında idam yarışına giren siyasetçilerin, birbirlerine attıkları urganları unuttuk. O kadar unuttuk ki, dünün ‘bebek katili’, bugünün ‘Sayın’ı oldu, yarın hürriyetine kavuşup, demokrasi havarisi ilan edilirse şaşırmam. Siyasetçilerin iki yüzlülüğünü unuttuk.
- Çadıra en çok ihtiyaç duyulan dönemde çadır satan Kızılay Başkanı’nı unuttuk. Hazır bu skandala değinmişken Eski Kızılay Başkanı Kerem Kınık’ın kızı Zehra Kınık Demir’in, ölümle sonuçlanan bir kazaya karıştığını hatırlatayım. Mahkeme süreci devam ediyor. Demir’in yüzde yüz kusurlu bulunduğu kayıtlara geçse de tutuksuz yargılandığını da hatırlatayım.
Liste uzar gider.
Hatırladıklarım değil de unuttuklarım yazılsa birkaç cilt çıkar. Yerim dar.
Bir an önce tedavi olmazsak, canımız daha çoook yanar.
Mustafa Kemalin Askerleriyiz diyen teğmenler ihraç edilir.
Parti başkanlarına, objektif çizgisinden ödün vermeyen gazetecilere Silivri yolu gözükür.
Toplum daha fazla sefalete mahkum edilir.
İnsanlık onuruna yakışmayan ücret verilir emekçiye.
Emekliye o kadarı bile çok görülür.
Sendikalar etkisini kaybeder; çalışanlar, aç gözlü patronun insafına terk edilir.
Hukukun üstünlüğü değil, üstünlerin hukuku hükümferma olur memlekette.
Bu liste de uzar.
6 Şubat depremiyle başladım onunla bitireyim.
Fenerbahçe taraftarı, 6 Şubat depremi sonrasında yaşanan ihmaller ve organizasyon eksikliklerini Konyaspor maçında tribünlerden protesto etti, 'hükümet istifa' sloganları attı.
Sonra ne mi oldu?
Kayseri İl Spor Güvenlik Kurulu skandal bir karara imza atarak sarı-lacivertli taraftarları Kayserispor-Fenerbahçe maçında tribünlere sokmadı. Diğer kulüpler de başını kuma gömdü.
Tribünler sindirildi.
SİLKELENME VAKTİ GELDİ
Bugün sindirilmiş gibi gözükebiliriz. Son günlerin moda kelimesiyle noktayı koyayım.
Bir silkelenmeye bakar. Türk Milleti silkelenip kendine geldiğinde neleri başardığını henüz unutmadık.
Yeter ki Alzheimer illetine düşmeyelim. Hafızamızı, toplumsal hafızamızı özellikle hep diri tutalım.
Ne kadar yalansız yaşarsak o kadar iyi. Hakikat bekçilerine selam olsun…
Pazarınız aydınlık olsun.
NOT: Travma toplumları gerçekten kaçarak yaşar. Gerçekle yüzleşmeden de normalleşemez.
Mustafa Hoş’un yazdığı ‘Neo Türkiye’nin Panzehiri Hafızadır’ kitabını okumanızı öneririm."
Huseyin Suekinci,3,2025,İcazet," 
Fenerbahçe, Glasgow Rangers’a penaltı atışları sonrası elenince ‘penaltı psikolojisi’ başlıklı bir yazı yazacaktım.
İyi de hazırlanmıştım aslında.
1986 Dünya Kupası’nda penaltı kaçıran futbol üstatlarından, Pele’nin bir maçta neden penaltı kullanmak istemediğine kadar çok az kişinin bildiği bir nostaljik yolculuğa bile çıkaracaktım sizleri.
20 Mart’ta yayınlanacaktı normal şartlarda yazım.
Gel gör ki, bu memlekette normal şartların yaşandığı gün sayısı çok az. O günleri yakalamak için tek başına maharet yetmiyor, şansın da yanınızda olması gerek.
DİPLOMA İPTAL, YAZMAK İSTEDİĞİM KONU DA…
18 Mart’ta, şanlı Çanakkale Deniz Zaferi’mizin 110. yıldönümünde, İBB Başkanı Ekrem İmamoğlu’nun üniversite diplomasının iptal edildiği haberiyle ‘Nasıl yani’ şaşkınlığını yaşadık ülke olarak.
Lafın gelişi öyle söyledim, memlekette yaşanan hiçbir şeye şaşırmıyoruz artık!
Baştan söyleyeyim, kimin diplomasında şaibe, usulsüzlük vs. varsa, elbette hesabı sorulsun. Bedeli neyse ödetilsin.
Ama herkes için gösterilsin bu hassasiyet. Bu konuda sanırım hem fikiriz. Ki ‘Diploma’ deyince akla ilk kimin geldiği hepinizin malumu.
Gençlik ve Spor Bakan Yardımcısı Hamza Yerlikaya’nın diplomasının sahte olduğu mahkemece tescillense de halen görevde.
Eeee nerede devletin savcıları?
MİLLİ MAÇIN OYNANDIĞI ŞEHRİN EMİNİ GÖZALTINDA
İmamoğlu’nun Türkiye-Macaristan maçını izlemeye gidip gitmeyeceğini öğrenmek için İBB Spor İstanbul Genel Müdürü Renay Onur’u aradım.
Tribünler her ne kadar son yıllarda sindirilse de, haksızlığa uğrayanların sesi olmaya devam ediyor.
Renay Bey’e bu tespitimi aktardıktan sonra; ‘Sayın İmamoğlu maça gidecek mi? Programında yoksa bile gitmesini öneririm’ dedim.
Akşam 21.30 sularında gerçekleşti bu konuşma. ‘Başkana ileteceğini’ söyledi Renay Bey.
İletmeye fırsatı olduğunu sanmıyorum.
Sanmıyorum, çünkü diploma iptalinin üzerinden 24 saat bile geçmeden İmamoğlu gözaltına alındı.
Yüzlerce polis sabahın köründe, şehrin emininin evini ablukaya almıştı. Davet ettiniz de gelmedi mi Sayın İmamoğlu?
Devletin sınırlı kaynaklarını -düzeltiyorum- vatandaşın belini büken vergileri çarçur etmeye kimsenin hakkı yok!
MİLLİ MAÇA BEN DE GİDEMEDİM
Macaristan maçına akredite olsam da 20 Mart’ta sahurumu yaparken abimden gelen telefonla allak bullak oldum.
Annem iyi değildi. Biz İstanbul’dan Yalova’ya gidene kadar 30 yıllık komşumuz Yaşar Dönmez teyzemiz, akrabam, insan denilince ilk aklıma gelen Tümer Tanrıkulu, annemi hastaneye yetiştirmişlerdi. Müteşekkirim.
Memlekette yöneticilerden yana yüzümüz gülmese de, komşu ve akrabadan yana şanslıydık.
EKO’YA ÜZÜLDÜM
Tansiyonu fırlamıştı, dilindeki kanama sayesinde belki de felç olmaktan kurtuldu annem.
‘Neye üzüldün anacım’ diye sorduğumda aldığım cevap, 17 yıl öncesine götürdü beni.
81 yaşındaki annem, ‘Eko’nun (Ekrem İmamoğlu) diplomasının iptal edilmesine üzüldüm. Sürekli uğraşıyorlar, ne istiyorlar bu çocuktan.’ diye sitem etti.
Ve ekledi.
‘İmamoğlu’na üzülmedim sadece, memleketteki hukuksuzluğa da üzülüyorum.’
Ardından ‘İmamoğlu’nun annesi-babası hayatta mı?’ diye sordu.
“Hayattalar, hatta annesi çok tatlı” anacağım dediğimde ‘Ben bu kadar üzüldüm, kim bilir anne babası nasıl üzülmüştür’ deyip iç çekti.
Sonra da “Gazetecileri de alıyorlar, sana da bir şey olur diye korktum, oğul” dediğinde gözleri bulutlanmıştı.
Bulutları dağıtmak için işi espriye vursam da 17 yıl önce yaşadıklarım geldi aklıma.
SANA DA BİR ŞEY OLUR MU?
Meşhur Ergenekon soruşturması ilk kez 12 Haziran 2007'de Ümraniye'de bir gecekonduda 27 el bombası bulunması sonucunda başlamıştı.
Ulusal Kanal’da reji amiri olarak çalışıyordum o yıllarda.
21 Mart 2008 Cuma günü, yüzlerce polis Deva Çıkmazı’nda bulunan TV binasını basmıştı.
Polis arama yaparken biz de bir yandan canlı yayın yapıyorduk.
Yandaş medya görevini yapıyordu elbette. Ağızlarından köpükler saçılıyordu adeta.
Öyle bir kirli propaganda yapılıyordu ki, bizler vatan haini, memleket düşmanı, güneş yüzü görmeyi hak etmeyen teröristlerdik.
Gece geç saatlerde eve geldiğimde, rahmetli babam ‘Sana da bir şey olur mu?’ diye sordu.
Babaların evlatlarına güven veren ses tonu, yerini endişeli bir edaya bırakmıştı.
O gece söylediğim sözler belli ki ikna etmemişti endişeli kalbini.
Ve sadece beş gün sonra, 26 Mart 2008 Çarşamba günü geçirdiği kalp krizi sonucu hayatını kaybetti babam.
Çarşamba gününün bendeki yeri ayrı. Babamı kaybettiğim aynı zamanda baba olduğum gün Çarşamba.
Babamın 17. ölüm yıldönümü bugün. Ruhun şad olsun emektar babam.
HAKİKAT KÖTÜLÜĞÜN AŞIRISIYLA DA ORTAYA ÇIKAR
23 yıldır iktidar aynı, bir türlü değişmiyor. Değişen, çocuğunun başına bir şey gelir mi diye endişe duyan anne babaların isimleri.
Dün Ali-Nezaket’ti, bugün Hasan-Havva.
Anne babalar, her ne kadar endişeli olsalar da, çocuklarının haksızlığa, çifte standarda ve hukuksuzluğa karşı sessiz kalmalarını istemiyorlar.
81 yaşındaki anam haksızlığa uğrayanlar için her ne kadar endişeli de olsa, ‘Dizim tutsaydı Saraçhane’ye ben de giderdim’ sözleriyle cesaret dağıtıyordu yüreklere.
Anamın bu çıkışı, örtülü bir icazetti aslında.
'Bedeli ne olursa olsun, haksızlık karşısında boyun eğme' öğüdüydü.
Anaların gözlerini yaşartan, babaların yüreklerini dağlayan zihniyetle mücadelemiz, devam edecek.
Özellikle icazetle bir yerlere gelebilen her kesime karşı.
Kaş’ta tanıştığım emekli edebiyat öğretmeni Günseli Hanım'ın nefis bir tespiti var: Kötülüğün aşırısıyla açığa çıkacak hakikatin zaferine inanıyorum.
Buna ben de inanıyorum.
Dün tutuklanan, 'Her şey çok güzel olacak' sloganının mucidi Berkay Gezgin'in sözleriyle bitireyim.
Her şey çok güzel olacak!
İcazet: 1. İzin, onay, onaylama.
2. Diploma.
NOT: Penaltı psikolojisini yazacak olsaydım, Uruguaylı yazar Eduardo Galeano’nun Gölgede ve Güneşte Futbol eserini önerecektim.
Konu değişince önereceğim kitap değişse de yazarı aynı. 
Eduardo Galeano: Ve Günler Yürümeye Başladı
Galeano, Latin Amerika’daki toplumsal mücadeleleri, halkın direnişini ve umudunu küçük hikâyelerle anlatıyor. Politik farkındalığı artıran, şiirsel bir anlatımı var. ‘Dünyanın vicdanı’ yakıştırmasını Eduardo Galeano'nun ne kadar hak ettiğini, bu kitap bir kez daha teyit ediyor."
