Yazar,Ay,Sene,Baslik,Cumle
Huseyin Suekinci,2,2025,Yabancı-laşma!,"Yabancılaşma teorisi, bireylerin birbirlerinden ya da içinde bulunduğu ortam veya zamandan uzaklaşmalarını ifade eden toplum bilimi teorisi.
Onun ölüm haberini aldığımda içimde bir şeylerin koptuğu hissine kapıldım, ruhumda yarattığı sarsıntının yanı başında.
Kendisini anlatmak benim harcım değildi, haddimi de aşıyordu.
Sonra derin düşüncelere daldım.
‘Eğer’lerle başlayan, sonu gelmeyen düşüncelere…
Hepsini size aktarmam mümkün değil elbette.
Mesela;
Eğer dedim, Futbol Federasyonu Başkanı olsaydı neler yapardı?
Almanya’da düzenlenen EURO 2024 şampiyonasında 613 ‘seçkin’ davetli için 3 milyon Avro harcayıp TFF’nin gelirlerini çarçur etmezdi.
Ammaaaa, Arda Güler için uçak kaldırırdı. Arda’nın Türkiye A Millî Futbol Takımı'nın Euro 2024 elemeleri çerçevesinde oynadığı Letonya maçında forma giydiği için, üniversite sınavını kaçırmasına izin vermezdi.
Üniversitede okuyan futbolcuların sayısının arttığına şahit olurduk.
Gençlik Spor Genel Müdürü olsaydı nelere imza atardı diye düşündüm bir ara.
Amatör spor branşlarında çağ atlardık.
Türk Sporunun gelişmesi ve yaygınlaşması için ne projeler üretirdi kim bilir?
Milli sporcuların uluslararası turnuvalara otobüsle gittiği, federasyon üyelerinin ise eşleriyle, birinci sınıf seyahatler yaptığı haberlere şahit olmazdık en azından.
Eğer siyasete atılsaydı neler olurdu diye düşündüm sonra.
Gençlik ve Spor Bakanı olsaydı mesela.
Çok da yakışırdı…
Devasa bütçeye sahip Spor Bakanlığı’nda lüks harcamalara, israfa, gösterişe yer olmazdı.
Spor akademileri hak ettiği kıymeti görürdü.
Spor ülkesi olurduk kısa zamanda. Doğal olarak sağlam akıllı insanlar ülkesi de.
Ya Adalet Bakanı olsaydı dedim peki.
Diplomasında şaibe iddiası olan kim varsa araştırılırdı.
İBB Başkanı Ekrem İmamoğlu 26 Şubat’ta ‘Lisans diplomasının sahteliği hususunda yapılan ihbarlar kapsamında’ soruşturmaya davet edildi malum. Davet edilsin elbette.
Diplomasında şaibe olan herkes davet edilsin.
Adaletin kılıcı, iktidarın kendisine muhalif olan herkese karşı salladığı silaha dönüşmezdi.
Kralla değirmencinin hikayesi gerçek olurdu ülkemizde.
Halkın en garibanı bile, değirmenci hikayesinde olduğu gibi, haklıysa krala kafa tutan köylüler misali ‘Berlin’de hakimler var’ diyebilirdi.
‘Sen benim kim olduğumu biliyor musun’ cümlesi tedavülden kaldırılırdı.
Adli Yargı Kura çekiminde yeğeninin adını zikreden vekili hatırlayacaksınız. Hızını alamadı, hakim yeğeniyle birlikte Adalet Bakanı’yla poz da verdi. Konya’ya atanan hakimin, kimin yeğeni olduğunu tüm dünya biliyor artık.
Milli Eğitim Bakanı olsaydı bir de.
Üfff, ne güzel olurdu.
Butik üniversiteler mantar gibi çoğalmaz, öğretmenini katleden talebeler olmazdı.
Atanamadığı için hayatına son veren öğretmen adaylarının haberleriyle yüreklerimiz dağlanmazdı.
Eğitimin kalitesi kesin artardı.
Öğretmeni fırçalayan bakan olmazdı en azından.
Çevre Şehircilik Bakanı olsa, halka imar barışı diye yutturulmaya çalışılan aslında çürük yapılara göz yumulan yasa tekliflerine, muhalefet şerhi koyardı.
Depremde göçük altında kalan binlerce canın, vebalini taşımazdı.
Ya Cumhurbaşkanı olsaydı?
‘Bu kadar yetki bir kişiye çok’ der, parlamenter sisteme dönüşü gerçekleştirirdi.
Kimden mi bahsediyorum?
Geçtiğimiz hafta hayatını kaybeden Prof. Dr. Fethi Heper’den.
Türk futbolunun profesör unvanına sahip ilk ve tek ismi.
Eskişehirspor’un efsane futbolcusu Fethi Heper’in ölüm haberiyle, ‘Türk futbolu yetim kaldı’ hissine kapıldım istemeden.
TRİBÜNLERİN ORKESTRA ŞEFİ DE YOK ARTIK
Bir haftadır kıvranıyordum, hislerimi nasıl kaleme dökeyim diye.
Hentbolun duayen isimlerinden Sinan Öner ağabeyimizi aradım. Fethi Heper’i yakından tanıyan biri olarak, bana yol göstermesi için ricada bulunmak istedim.
Bir acı haber de ondan geldi.
Türkiye’nin ilk amigosu olarak tanınan, tribünlerin orkestra şefi Amigo Orhan’ın (Orhan Erpek) vefat ettiğini söyledi acı bir ses tonuyla.
Eskişehirspor’un hayır hayır ülkenin meşhur amigosu…
Tribünlerin, birlikte hareket etmeyi öğrendiği adam.
‘Es Es Es Ki Ki Ki Eski Eski Es’ tezahüratı onun eseriydi.
Görev adamıydı. Bir maçta sahaya girilmesine izin verilmeyince skor tabelasının üzerine çıkıp, oradan coşturmuştu seyirciyi.
Sıradan bir amigo değildi Orhan Erpek.
Dönemin TFF Başkanı Orhan Şeref Apak tarafından Kuzey İrlanda’yla oynanacak milli maçta görevlendirilmişti.
Fenerbahçe’nin transfer teklifini kibarca reddetse de sarı lacivertlilerin Ajax ve Manchester City ile oynayacağı müsabakalarda iki maçlığına amigoluk yapmayı kabul etmişti. Tarihte ilkti.
‘Bir baba hindi
Heeey Allaah’
Bu sözlerin mucidiydi aynı zamanda.
Tribünler de yetim kalmıştı artık.
GÜNEŞLİ GÜNLERİ ÖZLÜYOR İNSAN
Beşiktaş’ın yo yo Türk futbolunun efsane Başkanı Süleyman Seba vefat ettiğinde de benzer duygular sarmıştı ruhumu.
Onunla son röportajı yapmak bana nasip olmuştu.
‘Geç kaldın evlat’ sözü kulaklarımda hâlâ.
Belki de onlar acele edip kışta gelmişlerdi.
Bilemiyorum.
Bildiğim bir şey var ama.
Süleyman Seba, Fethi Heper, Amigo Orhan…
Onların hayatlarını yeni nesillere aktarmak boynumuzun borcu.
Anılarını yaşatmak için gereken gayreti gösterirsek, bahar eninde sonunda gelecektir. Peşi sıra güneşli günler de.
Bağlayayım;
FUTBOLUN BAYRAMI
Bugün Galatasaray-Fenerbahçe derbisi var.
Eskiden futbolumuzun bayramı olarak kabul edilirdi.
Maç zamanı gelip çattığında, bayram telaşı yaşanırdı.
Karşılaşmayı tribünden izleyenlere Allah’ın şanslı kulları nazarıyla bakılırdı.
Kulüp başkanları nazik, futbolcular beyefendi, amigolar saygın, maçı yönetecek hakemler Türk’tü.
Taraftarlar da birbirini düşman olarak görmezdi.
Sonuçta ezeli rakiplerden çıkardı ebedi dostluklar.
Bugün Avrupa maçlarında bile ezeli rakiplerinin elenmesini diliyor eski dostlar.
Dost, dostun canına kıyar mı hiç!
Dost, dostundan canını esirger mi hiç!
SAYGI DURUŞUNU HAK EDİYOR
Bir teklifim var TFF’ye.
Derbi öncesi başlama vuruşundan önce Amigo Orhan için de saygı duruşunda bulunulsun.
Onun gibi bir spor dostundan, bütün taraftarların saygı duyduğu bir isimden saygı duruşunu esirgemeyelim.
YABANCI HAKEMLER YABANCI MAHKEMELER
Yabancı hakem yönetecek derbiyi.
Konu günlerdir hararetle tartışılıyor.
Milli duygular köpürtülüyor.
Demeçler havada uçuşuyor.
Fakat;
Müşteri garantili Yap-İşlet-Devret uygulamaları milletin sırtında yıllardır yük. Devletin bütçesinde koca bir kambur.
Bu sözleşmelerde uyuşmazlık halinde İngiliz yasaları ve Londra Tahkim Kurulu yetkili kılındığı için Türk kanunları uygulanamıyor.
Bu duruma gıkı çıkmayanların, yabancı hakem konusunda aslan kesilmeleri manidar değil mi?
Güven bunalımı yaşıyoruz her alanda.
Adalet duygusuna yabancılaştık.
Yabancı hakem kararı, içinde bulunduğumuz vahim tablonun son fırça darbesi mahiyetinde…
Gelinen nokta sebep değil, adalete olan güvensizliğin sonucudur.
Ortak bir noktada buluşuyoruz:
Adalet istiyoruz!
Şairin dediği gibi;
Bozuk adalet yeter artık!
Acemi ellerle yoğrulan, iyi pişirilmemiş adalet yeter!
Yeter katıksız, kara kabuklu adalet!
Dura dura bayatlayan adalet yeter!
...
Halkın ekmeğidir adalet.
Adaletin ekmeğini de
Kendisi pişirmeli halkın,
Gündelik ekmek gibi.
Bol, pişkin, verimli…
İYİ BİR DÜNYA BIRAKABİLMEK
Süleyman Seba, Fethi Heper, Amigo Orhan…
İyi insan olacağınıza, öyle bir yere götürün ki dünyayı, iyilik beklenmesin!
Ve bir gün çekip gittiğinizde bu dünyadan, iyi insandı diyeceklerine,
Arkasında iyi bir dünya bıraktı diyebilsinler, sizin için…
Mekanınız cennet, toprağınız bol, ruhunuz şad olsun…
Yazımın başında Fethi Heper’in ölüm haberiyle içimde bir şeylerin koptuğu hissine kapıldım demiştim.
Bir haftadır bunun cevabını arıyordum. Sanırım buldum.

Bu hafta size önereceğim kitap: Eskişehir’de Spor.
Sinan Öner ve Filiz Tiryakioğlu’nun müthiş bir emek harcadığı, titiz bir çalışma.
100 yılı içine alan eserin 1. cildi 1923 -1973 yıllarını kapsıyor. Üç cilt olarak planlandı ve Eskişehirspor için de ayrıca özel bir cilt yayınlanacak.
Fethi Heper’in ölümüyle birlikte, 2020 yılında Sinan Öner’in imzalayıp hediye ettiği kitabı bir kez daha inceleme gereğini duydum. Kitabı okuduğunuzda tarihte yolculuk yapıyorsunuz adeta. Yaklaşık 600 sayfalık bu nadide eser, arka kapakta yer alan Fethi Heper’in sözleriyle bitiyor.
HEPER’İN VASİYETİ
Eskişehir’de Spor Kitabı’nın ilk cildi, başta Sinan Öner ve Filiz Tiryakioğlu olmak üzere, değerlerine sahip çıkan bir avuç sporsever insanın kişisel gayretleriyle okuyucuyla buluştu.
Aradan 5 yıl geçmesine rağmen diğer ciltler basılamadı maalesef.
Prof. Dr. Fethi Heper’in, kitabın arka kapağında yazdıklarını okuduğunuzda eserin kıymeti daha net anlaşılacaktır. Diğer ciltler henüz basılamadığı için, Heper’in sözleri bir nevi vasiyet niteliğinde.
Başta Cumhurbaşkanlığı makamı olmak üzere, Gençlik ve Spor Bakanlığını, Milli Eğitim Bakanlığını, Eskişehir Büyükşehir Belediyesi’ni, TFF’yi ve tüm spor severleri, bu muhteşem eserin diğer ciltlerinin basılması için harekete geçmeye davet ediyorum.
Geçmişle bağımızı güçlendiren bu kitap, aynı zamanda değerlerimize yabancılaşmanın önünü de geçecektir.
Diğer ciltlerin, Fethi Heper’in 1. ölüm yıldönümüne yetişmesi dileğiyle…
"
Huseyin Suekinci,2,2025,Bu Fener izleyeni mest eder,"Fenerbahçe deyim yerindeyse burun farkıyla (bir gol averajıyla) yoluna devam ettiği UEFA Avrupa Ligi’nde Perşembe akşamı müthiş bir performans sergiledi.
Temsilcimiz, grup maçlarında ilk 8’i gol averajıyla kaçıran Belçika’nın köklü takımlarından Anderlecht’i deyim yerindeyse Şükrü Saracoğlu’nun çimlerine gömdü.
Bu sezon Süper Lig’de en fazla şutu direkten dönen takım unvanını elinde bulunduran Fenerbahçe, Rizespor maçında direkte patlayan 4 topuyla istatistikleri alt üst etmişti hatırlayacağınız üzere.
Geleneği bozmadı sarı lacivertliler. Anderlecht karşısında gecenin yıldızlarından Yusuf Akçiçek’in kafa vuruşu direkte patladığında dakikalar henüz 10’u gösteriyordu.
Saraçoğlu’nu dolduran on binler, kaçan gole hayıflanmaya fırsat bulamadı gerçi. Aradan 30 saniye bile geçmeden Kostic’in nefis ortasında Yusuf’un kafa vuruşu, Tadiç’e asist oldu adeta.
Kafa golüyle takımını 1-0 öne geçiren Dusan Tadiç, 36 yaş 85 gün ile Fenerbahçe formasıyla Avrupa kupalarının grup sonrası aşamalarında gol atan en yaşlı oyuncusu olarak tarihe geçiyordu aynı zamanda.
Kadıköy’de atmosfer nefisti. Fenerbahçeli futbolcular, sergiledikleri futbolla taraftarlarının gönlünü; dolunay, 14 Şubat Sevgililer Günü öncesinde İstanbul semalarını aydınlatıyordu.
TAKLACI GÜVERCİNLERE İNAT
Dakikalar 42’yi gösterdiğinde Yusuf-Kostic-Dzeko ortak yapımı gole şahitlik ediyordu sarı-lacivertli taraftarlar.
Sazı bir kez daha eline alan Yusuf, kendi yarı sahasında önce Degreef’in sonrasında Dendoncker’in faullü müdahalesinden kurtuldu.
Maçın hakemi Nikola Dabanovic, yardımcısının ısrarlı bayrağına rağmen, avantaj nasıl kullanılır, futbol nasıl güzelleştirilir dersi verircesine oyunu devam ettirdi.
Kim bilir belki de geçen yıl oynanan Fenerbahçe – Pendikspor maçını izlemiş, Pendiksporlu oyuncuların futboldan çaldığı 67 dakikaya şahit olmuştu.
Devam kararı, 19’luk Yusuf’un taklacı güvercinleri aratmayan meslektaşlarına özenmeyişinin ödülüydü belki de. Aferin sana çocuk.
Hakemin ders niteliğindeki kararı, Kostic’i de etkilemiş olacak ki müthiş bir depar attı Sırp futbolcu. Bu depar heba edilmemeliydi elbette.
Öyle de oldu. Yılların yıpratamadığı Edin Dzeko, ustalığını sergiledi ve fileleri havalandırdı. Kostic’in pasını asiste dönüştürdü, Tadic’in yaklaşık yarım saat önce kırdığı rekorunu da tarihe gömdü.
Fenerbahçe'nin Anderlecht karşısında ikinci golünü atan Edin Dzeko, 38 yaş 333 gün ile sarı-lacivertli formayla Avrupa kupalarının grup sonrası aşamalarında gol atan en yaşlı ismi oldu.
Bu rekor Tadic’le Dzeko arasında daha çok gider gelir gibi.
KAFA GOLÜ MÜ HAMİ MANDIRALI ŞUTU MU BİLEMEDİM
Kafasını kullanmayı çok iyi bilen En-Nesyri, maçın skorunu belirledi.
Ancak o nasıl bir kafa gölüydü be kardeşim.
Dünyanın en hızlı şutu Hami Mandıralı'ya ait. İddia ediyorum golle sonuçlanan en hızlı kafa şutu rekoru En-Nesyri’ye geçmiştir 13 Şubat 2025 tarihi itibariyle.
Gecenin çalışkanlarından Szymanski’nin yaptığı nefis ortanın hakkını da teslim edelim.
İRFAN’DAN KRİTİK KURTARIŞLAR
Son haftaların formda isimlerinden İrfan Can Eğribayat, kritik dakikalarda önemli kurtarışlarıyla alkışı fazlasıyla hak etti. Skor 1-0’ken 24. dakikada Adryelson kafa vuruşundaki refleksi müthişti.
68’de Huerta’nın şutunu çıkarmak her kalecinin harcı değildi. Uzadı resmen.
TARAFTARLAR SEVGİLİLER GÜNÜNÜ ERKEN KUTLADI
Fenerbahçeli taraftarlar Kadıköy’de uzun zaman sonra stressiz bir maç izledi desem abartmış olmam sanırım.
Bırakın strese girmeyi mest oldu on stattaki on binler, televizyon başındaki milyonlar...
Sevgiler gününü erken kutlamaya başlayan sarı lacivertli taraftarda maç sonunda şu görüş hakimdi: Bu Fener, herkesi yener."
Huseyin Suekinci,2,2025,Mızrak çuvala sığmıyor artık!,"Ben sporcunun zeki, çevik ve aynı zamanda ahlaklısını severim. (Mustafa Kemal Atatürk)
Çocukluğum Kars’ta geçti.
Top, hâlâ en sevdiğim oyuncak.
5’te devre 10’da biten ve gol atamayınca saatler süren maçlarımız olurdu.
Alekke ve Güneşspor’dan oluşan 2 takımlı ligimiz vardı. İkisinde de oynadım.
Mahalle maçımız olduğunda iki takımın karmasından oluşan bir nevi milli takımımız bile vardı.
Boşaltılan Çakmak Kışlası ve Hafız Hakkı Paşa Lojmanları’nda subay çocuklarıyla olan maçlarımız, çok çekişmeli geçerdi.
Yeri gelmişken hatırlatayım, mühendislik harikası olan bu tarihi askeri yapılar, şimdi sahipsiz bir şekilde kaderine terk edilmiş durumda.
Bizi en çok cezbeden, askeri lojmanlardaki sahanın kale direklerinin olmasıydı. Kıran kırana geçen maçlarımızda, ‘goldü, değildi’ tartışmaları olmuyordu en azından.
Yine çekişmeli geçen bir maçtı. Sol kanattan kale direğinin soluna gelen ortaya kafayla vurmaya çalıştım. Uzansam da yetişemedim. Ani bir refleksle sağ yumruğumla topa vurdum.
Polisgücü’nde boksa da gidiyorduk o yıllarda. Resmen sağ kroşeyle vurmuştum meşin yuvarlağa ve gol olmuştu.
Sevinmedim attığım gole, sevinemedim çünkü nasıl olsa herkes elimle gol attığımı görmüştür diye düşünmüştüm.
Düşündüğüm gibi olmamıştı. Takım arkadaşlarım çılgınca sevinirken, subay çocuklarında moraller bozuktu tabi.
Bizimkilerin duyacağı şekilde ‘Elle attım golü’ dedim. Arkadaşlardan biri ‘Ola sükut dur, kimse anlamadı’ diye azarladı beni.
Golü elimle attığımı söyleyemedim o an. Emin değilim ama maçı kazandık diye hatırlıyorum, belki de bir farkla.
O maç her aklıma geldiğinde utanırım. Aradan 35 yılı aşkın bir süre geçmiş olsa bile…
Bir daha da tevessül etmedim böyle bir şeye.
Gecikmiş bir özürle başlamak istedim yazıma.
O günkü maçta oynayan subay çocuklarından özür diliyorum.
Çocukluk anımı, mahcubiyetimi niye paylaştığıma gelince…
FUTBOL ATMOSFERİ KEYİF VERMİYOR ARTIK
Pazar günü oynanan Galatasaray-Adanademirspor müsabakasında, Adana temsilcisi maçtan çekildi malûm.
Hakem hatalarını konuşacak değilim.
Aldatmaya yönelik bir hareketi profesyonellikmiş gibi göstermeye çalışan futbolcuları, buna çanak tutan teknik adamları, ateşe körükle giden yöneticileri, gerekli hassasiyeti göstermeyen TFF’yi, reyting uğruna objektifliğini kaybeden meslektaşlarımı ve son olarak ‘Vur kır parçala bu maçı kazan’ anlayışındaki taraftarları yazmak istedim.
Bildiğiniz gibi maçları onlarca kamera çekiyor. ‘Yarın çocuğumun yüzüne nasıl bakarım’ hassasiyeti olan bir baba, onlarca kamera önünde hakemi aldatmaya çalışmaz, çalışmamalı. Ama gelin görün ki profesyonel dublörlere taş çıkartan futbolcular var. Onlarcasını sıralarım.
Mertens, Pazar gecesi yarıda kalan maçın ardından, dünyalar güzeli evladını kucağına alıp taraftarları selamladı. Mimiklerinde zerre pişmanlık yoktu.
Binlerce taraftar, övünülecek bir şey yapmış gibi çılgınca alkışladı Belçikalı futbolcuyu. Daha önce defalarca sergilediği ‘Oyunculuk’ yeteneğini ödüllendirdiler adeta.
YEŞİL ÇİMLER ARENA OLDU
Kölelerin aslanlara parçalatıldığı Colosseumlar ve bundan keyif duyan Romalılar geçti o an için zihnimden. Ürperdim…
Okan Buruk, maçın ardından ‘Benim için penaltı olmamaya daha yakın!’ ifadelerini kullandı. ‘Penaltıyla uzaktan yakından alakası yok be kardeşim.’ deme cesaretini gösterebilirdi. Buruk, cesaret hakkını Adanademirsporlu 21 yaşındaki Yusuf Barasi’ye sinkaflı kelimeler sarf ederek kullandı. Galatasaraylı teknik adam, Adanademirspor Başkanı Murat Sancak’ın bu yöndeki iddialarını yalanlasa da sosyal medyada o anın görüntüleri var. İzleyin, taktir sizin.
'Gecenin asıl mağduru Galatasaray’dır.' diyenlerin sayısı az değil.
Okan Buruk basın toplantısında ‘Bu kararın masum ve anlık bir karar olduğuna inanmıyorum.’ diyerek Adanademirspor cephesini ciddi bir töhmet altında bıraktı. Benzer açıklamalar Galatasaray İkinci Başkanı Metin Öztürk’ten de geldi. El artırdı, ‘Pusuda bekleyenler var.’ dedi. ‘Çamurda güreşenler’ sözünü kullansa da devamını getirmeye cesaret edemedi sanırım.
Adanademirspor cephesi, bu açıklamalara tepkisini ‘Bu karar, sistematik hale gelmiş bilinçli hakem hatalarına ve adaletsizliğe karşı kulübümüzün ortaya koyduğu bir tepkidir.’ ifadeleriyle dile getirdi.
ASIL MAĞDUR KİM?
Medyaya gelince. Erman Toroğlu SÖZCÜ’deki köşesinde geceyi ‘Ali Sami Yen izlese ayıp olmuş derdi!’ başlığıyla özetledi.
Asıl mağdurun Galatasaray olduğunu hararetli bir şekilde savunan gazeteciler de var.
Konu dünya basınında geniş yer bulunca bu durumdan rahatsız olanlara ne demeli peki?
3 Temmuz sürecini hatırlayın. Polis fezlekelerini kesin gerçeklermiş gibi göstermeye çalışıp algı yaratanlar, ezeli rakibini koşa koşa UEFA’ya şikayet edenler, hangi kulübün yöneticileriydi?
Taraftarlara gelince. Sarı kırmızılı taraftarlar hakem hatalarından oluşan kolajlar paylaştı. Rakip takım taraftarları boş durur mu? Onlar da Galatasaray lehine verilen hakem kararlarını, videolarla hatırlattı sosyal medyada.
Arşiv savaşı iyice kızıştı.
2 hafta sonra derbi var. Allah sonumuzu hayretsin.
Bitireyim.
KİMLERİN DEĞİRMENİNE SU TAŞIYOR BU MEÇHUL YAPI?
Galatasaray cephesi yıllardır ‘yapı’ vurgusu yapıyor. Üst üste şampiyon olsa da, farklı kazandığı maçların sonrasında da, en yakın rakibi kimse onun üzerinden de yapıyor.
Kabak tadı verdi resmen.
Evet bir yapı olduğu kesin. Peki, kimin değirmenine su taşıyor bu gizemli yapı?
Cevabı sorularda saklı.
Takla atmakta meşhur, hakemi aldatmakta mahir futbolcular deyince aklınıza ilk hangi isimler geliyor?
Futbolculuğu döneminde yönetici dövmüş, muhabirleri tartaklamış, rakip oyuncunun dişlerini dökmüş, hakemin suratına tükürmüş ve hatta polis zoruyla sahadan çıkarılmış ‘centilmenlik abidesi’ futbolcu desem. Kim ve hangi takım gelir aklınıza?
Öyle kolaycılık yok, minik bir araştırmayla bulursunuz kim olduğunu!
Hakemi ‘Bir daha burada görev alamazsın.’ diye tehdit eden teknik adam,
Maç sırasında yaptığı taşkınlıklar nedeniyle tribüne gönderilen, sonrasında verdiği demeçleriyle hakemleri aşağılayan, hatta kötü sözler söylediğini itiraf eden, 9 maçlık rekor ceza alan teknik adam hangi kulübün hocasıydı?
İktidarlar değişse de ülkeyi yönetenlerle arası her daim iyi olan spor kulübü sizce hangisi?
Resmi posterinde dönemin İçişleri Bakanı’nın da olduğu kulübün Çemişgezekspor olmadığı kesin.
Seçim zamanı siyasetçilere yanağını okşatan başkan deyince hatırınıza gelen zatı muhterem de aklınızın bir köşesinde dursun derim?
Seçil Erzan dolandırıcılık davasında adı geçen isimler hangi takımı işaret ediyor?
Cemaatlerle anılan, yasa dışı bahis sitesinden reklam alan, karaborsada adı geçen, hatta geçmişte UEFA’dan karaborsa bilet satışına izin verdiği için ceza alan, çifte kontratlarla devletten vergi kaçırdığı ayyuka çıkan ancak işlem yapılmayan kulüp peki?
Yoruldum, gerisini sizlerin hafızalarına havale ediyorum.
‘Bisküvi denince akla hemen onun adı gelir.’ desem hangi marka aklınıza geliyorsa, yapı denince hayalinizde canlanan kulübü tahmin etmek zor değil.
Evet bir yapı var, oldukça çürük bir yapı hem de. O yapı mutlaka çökertilmeli. Spor ikliminin selameti için çökertilmek zorunda.
Mızrak çuvala sığmıyor artık! Herkesin gözü önündeki gerçekler daha fazla örtbas edilemeyecek. Adanademirsor, 9 Şubat'ta fitili ateşledi belki de, kim bilir?
Not: Serhan Asker’in yazdığı ‘Efsane Değil İnsanım’ kitabını okuyun derim. Ruhunuza iyi geleceği düşüncesindeyim."
