Yazar,Ay,Sene,Baslik,Cumle
Huseyin Suekinci,1,2025,‘ŞUBAT'ı avutamamışken ‘OCAK'ımıza ateş düştü,"İki yıl ne de çabuk geçti.
120 bin kilometre karelik alanda 11 ilimiz, 124 ilçemiz, 7 bine yakın köyümüz ağır yıkıma uğramış, resmi rakamlara göre 53 bin 537 can, canından olmuştu.
Büyük felaketlerde kenetlenmeyi başarabilen bir milletiz. 17 Ağustos Marmara Depremi'nde olduğu gibi, 6 Şubat Kahramanmaraş Depremi'nde de tek yumruk olmuştuk.
İşyerlerini, marketleri yağmalayan, çaldığı beyaz eşyayı arabasına yüklerken kameralar karşısında yüzü bile kızarmayan birkaç talihsizin dışında, herkes taşın altına elini sokmuştu.
Deprem bölgesine gitmiş biri olarak milletimizin alicenaplığına bizzat şahit oldum.
Gıda yardımlarından ‘istediğiniz kadar alın’ denmesine rağmen, bir öğünden fazlasına tenezzül etmeyen yüce gönüllü insanlara da…
‘BİZLERİ UNUTMAYIN YETER’
Depremzede kardeşlerimizin ortak bir arzusuna da şahit olmuştum. Maraş, Adıyaman, Hatay; yıkımın ve can kaybının en fazla olduğu illerimizdi. Yardıma koşanlara, depremzedelerin verdiği mesaj netti:
Bizleri lütfen unutmayın!
Toplum olarak kenetlenmekte mahir olsak da unutmak en büyük zaaflarımızdan maalesef.
Balık hafızalıyız desem yeridir.
Unutulmak büyük bir yıkım. İnsan ruhunda yarattığı hasar, Richter ölçeği ile ölçülemez.
Öte yandan felaketlerin insanoğlu için yıkıcı bir yanı da unutulmaz oluşları.
17 Ağustos depreminde üniversite 3. Sınıf öğrencisiydim. İstanbul Üniversitesi İletişim fakültesinde öğrenci temsilciydim üstelik. Kıymetli hocam Prof. Dr. Nurdoğan Rigel, ‘yardımları ulaştırdığınız noktalarda fotoğraf da çek’ demişti. Fakültemizin çıkardığı İletim Gazetesi’nde kullanacaktık.
Sahra hastanesine dönüştürülen Yalova Stadı’nda yaralı bir depremzedeyi kurtarmak için koşturan doktorların mücadelesi dün gibi aklımda.
Fotoğraf makinemin flaşını açmadan fotoğrafını çektiğim yaralının ölümüne şahit olmuştum.
Mevtanın üzerine örtülen beyaz örtü, ailesinin feryadı, doktorların kederli hali... Dün gibi net hafızamda. Çadırın bir köşesine gidip kimseye çaktırmadan ağlamıştım.
Sakarya’ya da gitmiştim. Depremin 7. günüydü sanırım, yerle bir olan Elmas Oteli’nden askerlerin çıkardığı cesetlerin kokusunun etkisini, yıllarca atamadım üzerimden. Gazetecilik zor bir meslekmiş meğer. Bugünlerde daha da zor gerçi ancak yazının konusu değil…
Bu yazıyı 17 Ağustos Depreminde orta hasarlı olan ve yıllarca oturamadığımız Yalova’daki baba evimden yazıyorum.
Depremde hiçbir yakınımı kaybetmemiştim, 22 yaşındaydım ve gazeteci adayıydım.
Şahit olduklarımı hatırladığımda hala sarsılıyor ruhum.
Sizleri çeyrek asır öncesine neden götürdüm?
Açıklayayım;
Felaketlerde en büyük travmayı çocuklar yaşıyor maalesef. Şahit oldukları acılar, ruhlarında kalıcı hasarlara da yol açabiliyor.
Bunun tamiri için, uzun süren ve devamlılık isteyen psikososyal etkinlikler yapılması şart.
TFF’YE BÜYÜK GÖREV DÜŞÜYOR
Adıyaman’da 6 Şubat depreminden tam 113 saat sonra enkazdan çıkarılan Mesut’un sedyede söylediği sözler, 85 milyonun yüzünde tebessüme yol açmıştı. Yıkılan koca kolonları adeta çalımlayıp hayata tutunmayı başarmıştı minik Mesut. Milli futbolcumuz Arda Güler’e olan sevgisi, Fenerbahçe’nin eski hocası Jorge Jesus’a ‘Arda Güler’i daha fazla oynat’ sözleri moral olmuştu vatandaşlarımıza.
Adıyamanlı Mesut’tan yola çıkarak, Türkiye Futbol Federasyonu’na birkaç önerim olacak:
MESUTLARI MESUT ETMEKTEN GERİ DURMAYIN 
- TFF, başta Türkiye Kupası maçları olmak üzere, bazı müsabakaların deprem bölgesinde oynanması için öncülük edebilir.
- Milli Eğitim Bakanlığı ve kulüplerle işbirliği yaparak, bölgedeki öğrencilerin, en azından derslerinde başarılı olan öğrencilerin 4 büyüklerin maçlarını izlemeleri için organizasyon gerçekleştirebilir.
- Depremde yakınlarını kaybeden ailelerin, Avrupa Ligi’nde mücadele eden takımlarımızın maçlarını statta izlemeleri için adımlar atabilir.
- Adıyamanlı Mesut gibi onbinlerce Mesut’u, hayranı olduğu futbolcularla bir araya getirebilir.
- 2025 Ziraat Türkiye Kupası Final maçını deprem bölgesindeki Süper Lig’de takımı olmayan illerden birinde oynatabilir.
- UEFA Uluslar Ligi play-off ilk maçında 20 Mart’ta Macaristan’ı konuk edeceğiz. Milli maçta, depremzede 100 çocuk hatta daha fazlası onore edilebilir. Gönlü yaralı, ruhları incinmiş çocukların duaları, sahadaki futbolculara itici güç olacaktır.
İşin tabii finansal boyutu var ancak bu durum TFF’yi kesinlikle etkilemez. Üşenmedim hesapladım. 23 Ocak 2025 PFDK kararlarında, toplam 3 milyon 518 bin 850 TL ceza kesilmiş kulüplere ve yöneticilerine. Sadece 1 haftalık ceza miktarı. Liglerin boyu kısalıp yarış kızıştıkça TFF’nin ceza gelirleri katlamalı olarak artıyor. İstatistiklerin yalancısıyım.
Federasyon seçiminde ‘Biz Anadolu’yu gezen başkan olacağız’ sözü veren TFF Başkanı İbrahim Hacıosmanoğlu’ndan umutluyum. Sayın Başkan, Anadolu’daki depremzede çocuklarımızı bir nebze olsun mutlu etmekten geri durmayacaktır.
21 Ocak’ta Bolu Kartalkaya’daki otel yangınında 36’sı çocuk 78 yurttaşımız hayatını kaybetti. Hayatını kaybeden yurttaşlarımızın ailelerine sabrı cemil, yaralı vatandaşlarımıza acil şifalar diliyorum.
Köşe yazarlarımızdan Nedim Türkmen, eşi Ayşe Neva, kızı Ala Dora ve oğlu Yüce Ata da hayatını kaybedenler arasındaydı maalesef. Sorumluların gereken cezayı alması ve bir daha benzer felaketler yaşanmaması adına SÖZCÜ gazetesi üzerine düşen kamu görevini sonuna kadar sürdürecektir.
Nedim abi kendini çok iyi yetiştirmiş bir ekonomist olmasının yanı sıra centilmen bir spor insanıydı. Orduspor Başkanı seçildikten sonra takımını Süper Lig’e çıkaran başarılı bir yöneticiydi aynı zamanda.
Nedim Türkmen, başarı için her yolu mübah gören yöneticilerden olmadı. 26 Ocak 2012’de yapılan TFF olağanüstü genel kurulunda, 58. madde değişikliğine ‘Hayır’ oyu vermiş, Türk futbolunun etik değerlerine olan bağlılığını göstermişti Nedim abi.
'Şike'ye teşebbüs halinde bile ligden düşürme cezasını kaldıran 58. Madde.
Kaybımız büyük, acımız sonsuz.
Ruhlarınız şad olsun..."
Huseyin Suekinci,1,2025,Mızıkçılık yapma! Hadi sen de oyna!!!,"İnsanı tanımak, tam anlamıyla tanıyabilmek bazen bir ömür alabiliyor. Hayatında ‘Ben bu insanı nasıl da tanıyamamışım’ demeyen birini gördünüz mü hiç? Ben henüz görmedim.
Bir kişiyi tanımanın üç kısa ve etkili yolu vardır derler.
Yolculuk, alışveriş (ticaret) ve komşuluk.
Buna ben de bir şey eklemek istiyorum.
Oyun.
Yüzde yüz geçerliliği olmasa da önemli doneler verir size oyun arkadaşınızın sergilediği tavır, aldığı tutum, gösterdiği tepki.
Aklınıza gelebilecek tüm oyunlarda. Tavla, satranç, hatta kumar oyunlarında bile.
Dürüst mü, centilmen mi, üç kağıtçı mı, hırslı mı, kolay pes eden biri mi yoksa inatçı keçinin teki mi? Paylaşımcı biri mi. Kazanmak için her yolu mübah gören hırs küpü mü? Gol atmaktan mı keyif alıyor asist yapmaktan mı? Zafer elde ettiğindeki tutumuyla hezimete uğradığında sergilediği davranışları nasıl? Empati yeteneği ne alemde? Bencil mi ya da iğneyi kendine batırabiliyor mu? Yüzlerce örnek verebilirim. Aklınızın bir köşesinde bulunsun.
Bunları neden yazdım? Nereye bağlayacağım?
Anlatayım.
ÇOCUKLARIMIZI NE KADAR TANIYORUZ?
Çocukların dört gözle beklediği ara tatile girdik malum.
Lise bire giden kızımla karar aldık, düzenli spor yapacağız diye. Yazın bol bol yüzüp masa tenisi oynasak da yeterli değil elbette. Yüzmeyi öğrendiği Türkiye Spor Yazarları Derneği’nin (TSYD) Leventteki tesislerine gidip spor yapacağız düzenli olarak. Bu sayede birbirimizi biraz daha iyi tanıma fırsatımız olacak belki de…
Ebeveynler olarak çocuklarımızı yeterince tanımıyoruz maalesef.
Kaliteli zaman geçirmiyoruz.
Bu noktada sayısız bahane üretmekte üstümüze yok üstelik.
Ancak;
Çocukların kolaylıkla ulaşabileceği, geçim derdiyle boğuşan velilere masraf çıkarmayacak ve güvenli bir şekilde spor yapabileceği alanlar yeterli mi?
ÇOCUK VE MEKÂN
Marmara Üniversitesi Spor Yönetim Bilimleri’nde Yüksek Lisans öğrencisiyken, Çocuk ve Mekân konulu ödevimde bu konuya yer vermiştim.
İstanbul’da nüfus oranı kontrolsüz bir şekilde artarken, yeşil alanlar ve oyun parkları kontrollü bir şekilde azalıyordu. İmdada okul bahçeleri yetişiyordu.
Bizler şanslı nesilleriz.
80’li yıllarda oyun alanlarımız alabildiğine genişti. Betonlaşmamıştı büyükşehirler bile.
Kars’ta, özellikle bahar mevsiminde yağmur yağdıktan ya da karlar eridikten sonra mahallemizdeki top sahasından traktörlerin geçmesi, en büyük kabusumuzdu. Kocaman tekerlekler perişan ederdi sahamızı. Çimenler boy atıp top sahamız kendine gelene kadar Zübeyde Hanım İlkokulu’nun bahçesinde sürerdi futbol tutkumuz. 5’te devre 10 gol atanın kazandığı, süre olmadığı için saatlerce devam eden, dilimizi dışarda bırakan tutkumuz.
OKULLARIN BAHÇESİ RANT KAPISI OLDU
O günler geride kaldı kalmasına da yapılan icraatlar pes dedirten cinsten.
Eğitim haberleriyle fark yaratan Sultan Uçar imzalı bir haber yayınlandı geçtiğimiz günlerde SÖZCÜ’de.
Okul bahçeleri otopark oluyor! diye.
Nasıl yani diye sormadan edemedim haberi okuduğumda.
‘İstanbul’dan Hatay’a okul bahçeleri otopark, bodrumları depo ve spor salonları bu ay içinde açık artırma ihalesiyle kiraya verilecek.’ diye başlıyordu haber.
Otopark ihalelerinden gelecek olan yüzlerce milyonluk gelir, bakanlıklar arasında pay edilecek, temizlik personelinin parasını bile ödeyemeyen okullara ekstra bir gelir sağlanmayacaktı üstelik. Haberin ayrıntısını aşağıdaki linkten okuyabilirsiniz gözünüzden kaçtıysa.
https://www.sozcu.com.tr/okul-bahceleri-otopark-oluyor-p125618
Allah akıl fikir versin.
İşin acı tarafı, artık şaşırmıyoruz neredeyse hiçbir şeye.
Tepkisiz bir topluma dönüştürüldük çeyrek asırda.
Görmek, acı gerçekleri görmek hele ki, hastalık kabul edilir oldu körler diyarına çevrilmiş memlekette.
Bu meseleyi kıymeti bilinmeyen sosyologlara havale edip konuya döneyim.
ÇOCUKLARINIZLA FUTBOL MAÇINA GİTMEYİN
Spor tutkunu bir baba olarak bu yazıyı anne babalar için yazdım.
Galiz küfürlerin edildiği futbol maçına götürmeyin bu aralar çocuklarınızı.
Hakem kararlarına ana avrat küfreden, tuttuğu takımın futbolcusunun performansını beğenmediği için yedi sülalesini yad eden, yaşadığı stresin acısını tribünlerde fütursuzca çıkaran, gün geçtikçe fanatikleşen taraftarlardan uzak tutun bu aralar çocuklarınızı.
Sırf maçlara gidebilmek için Hukuk Fakültesi, Kamu Yönetimi vs. gibi bölümleri kazanabilecek puanım varken gazeteciliği tercih etmiş biri olarak acı verse de tekrar vurgulamak isterim, bu atmosfer devam ettiği sürece futbol maçlarına götürmeyin yavrularınızı.
Hele ki derbi maçlarına… Aman diyorum.
EN SON NE ZAMAN OYUN OYNADINIZ?
Çocuklarınızla oyun oynayın. Her fırsatta oynayın.
Oyun her yaşta oynanır, doğumdan ölüme kadar! Ama bütün özelliklerini içinde bulunduran gerçek oyunlar çocukluk dönemlerinde oynanır. Çocukluk dönemi hep oyun demektir.
Oyun; çocuğun psikomotor gelişim ve becerilerinin kazanılması, sosyal ve dil gelişimlerinin tamamlanması için en gerekli araçtır.
Günümüz çocuklarının en büyük handikabı yeterince oyun arkadaşlarının olmaması değil mi?
Oysa ki bizler, bir oyundan sıkılsak anında başka bir oyun icat eden nesildik.
Ya şimdilerde…
Teknolojinin esiri oldular evlatlarımız.
Görme bozuklukları, obezite yaygınlaştı.
Anti sosyal varlıklara dönüşüyor en kıymetlilerimiz.
Büyüdüklerinde ‘Bu çocuk niye böyle oldu’ diyenlerin sayısı o kadar çok ki.
Özetle;
Milli Eğitim Bakanlığı (MEB), elinden gelse ‘Beden Eğitimi’ dersini müfredattan çıkaracak. Çocukların oyun alanlarını otoparka çeviren zihniyetten bir beklentim yok.
Evladı için gözünü kırpmadan canını verecek anne babalardan ise çok.
Canınızı vermenize gerek yok canlarınız için.
Biraz daha fazla oyun oynayın kâfi. Oyun oldukça verimli spordur aynı zamanda. Emin olun bu sizlere de iyi gelecektir.
NOT:
Çocuğunuzla oyun oynadıktan sonra bir de güzel film izleyin birlikte.
Önerim;
CENNETİN ÇOCUKLARI
Yönetmenliğini Majid Majidi’nin yaptığı, Oscar Ödüllerinde İran’ın adayı olmayı başarabilen kült bir yapım.
1997'de çekilen film, bir çift ayakkabıyı paylaşmak zorunda olan iki kardeşin hikayesi üzerinden Ortadoğu kültürünü naif bir sinema diliyle anlatan aynı zamanda yoksulluk üzerinden hayatın adaletini sorgulatan bir yapıt. Toplumdaki sınıf ayrımını, derin maddi uçurumu, iletişimsizliği, yabancılaşmayı ve tüm bu çözülmeye rağmen, değerlerine, inançlarına sarılan insanların hayata tutunuşlarını, kaybolan bir çift eski ayakkabı üzerinden başarıyla anlatan eleştirel bir film."
Huseyin Suekinci,1,2025,Rusya'ya yasak İsrail'e kıyak,"FIFA ve UEFA’nın iki yüzlülüğüne yıllardır şahit oluyoruz ve maalesef futbolun paydaşları bu durum karşısında gerekli refleksi hiçbir zaman tam olarak ortaya koyamadı.
Rusya’nın Ukrayna’yı işgal etmesiyle FIFA da UEFA da hızlı bir refleks gösterdi. Rusya Milli Takımı ve Rus kulüpleri uluslararası müsabakalardan men edildi. Bir hafta içinde alındı bu karar ve doğrusu da buydu.
7 Ekim 2023’te Hamas’ın saldırısını bahane eden İsrail, Filistin halkına karşı onlarca yıldır sürdürdüğü insanlık suçunda dozu öyle bir artırdı ki aradan geçen 69 haftada Gazze’de yaklaşık 18 bini çocuk, 13 bini kadın, toplam 50 bine yakın sivili katletti.
İsrail, içinde hasta olan hastaneleri vurdu, okulları bombaladı, cami kilise ayırt etmeden ibadet yerlerini havaya uçurdu.
Sadece alt yapıyı değil, Filistin’in kültürel mirasını doğrudan hedef alarak onlarca tarihi yapıyı da yok etti.
İnsani yardımları engelledi, Dünya Sağlık Örgütü (WHO) çalışanları dahil binden fazla sağlık çalışanını, 200’den fazla gazeteciyi öldürdü.
Uluslararası Ceza Mahkemesi (ICC) 21 Kasım 2024’te İsrail Başbakanı Binyamin Netanyahu ve eski İsrail Savunma Bakanı Yoav Gallant hakkında insanlık suçu işledikleri gerekçesi ile tutuklama kararı verdi. Futbolun patronları kulaklarının üstüne yatmaya devam etti.
Bitmedi…

Gazze’deki katliamı yok sayan UEFA, icraatlarıyla da alenen çifte standart uygulamaktadır.
Nasıl mı? Birkaç örnek vereyim.
Beşiktaş’ın UEFA Avrupa Ligi’nde Maccabi Tel Aviv ile evinde oynayacağı maç, güvenlik nedeniyle Macaristan’ın Debrecen kentine alındı. Maç seyircisiz oynandı ve temsilcimiz 3-1 mağlup oldu.
Beşiktaş hem ciddi bir hasılattan mahrum oldu hem de seyirci avantajından yararlanamadı. İşin ilginç tarafı ne Beşiktaş kulübü ne de Türkiye Futbol Federasyonu (TFF) bu skandal karara gerekli tepkiyi göstermedi.
Beşiktaş Basketbol Takımı da İsrail ekibi Hapoel Shlomo maçını İstanbul'da değil güvenlik gerekçesiyle tarafsız saha olarak Sırbistan'da oynamıştı.
Amsterdam'da 7 Kasım'da oynanan Ajax-Maccabi Tel Aviv maçı öncesi ve sonrasında İsrailli taraftarlar, Filistin destekçilerine saldırdı.
İsrail’deki en ırkçı ikinci taraftar grubu olarak kabul edilen Maccabi Tel Aviv taraftarlarının maça gelmelerine izin verilmesi bile başlı başına bir skandaldır.
Maçın ardından, gösteri yasağı getirilen Hollanda’da Dam Meydanı'nda toplanan Filistin destekçileri; Netenyahu’yu protesto edenlere bile saldıran ırkçı Maccabi Tel Aviv taraftarlarının başlattığı olayların Filistinlilere mal edilmesini ve medyanın bu olayları ‘antisemitizm’ ( Yahudi milletine karşı duyulan düşmanlık, nefret, önyargı veya ayrımcılık) olarak yansıtmasını protesto etti.
UEFA protestoları umursamadı!
Gittikleri her maçta soykırım yanlısı slogan atan bu holiganlardan ötürü Ajax maçında yaşananlar görmezden gelindi ve Maccabi kulübüne herhangi bir yaptırım uygulanmadı.
Hatırlayın EURO 2024’ün son 16 turunda Türkiye-Avusturya karşılaşmasında galibiyet sevinci sırasında yaptığı 'bozkurt selamı' nedeniyle Merih Demiral 2 maç ceza almıştı.

 
UEFA, 2020 Avrupa Futbol Şampiyonası elemelerinde asker selamı veren milli oyuncularımız hakkında hareketin siyasi olabileceği gerekçesiyle soruşturma açmış gelen tepkiler üzerine geri adım atmıştı.

 
Beşiktaş ile Maccabi Tel Aviv maçında karşılaşmanın ilk golünü atan İsrailli futbolcu Gavriel Kanichowsky gol sevincini İsrail bayrağına asker selamı vererek yaşasa da soruşturma açmaya gerek duymamıştı UEFA.

Filistin halkına destek olmak FIFA ve UEFA nezdinde affedilmez bir kabahat olarak görülüyor.
Ağır yaptırımlarla kulüplere ve Milli takımlara gözdağı veren futbolun patronları, bunun meyvelerini de almışa benziyor.
14 Ekim 2009 tarihinde Bursa’da yapılan Türkiye - Ermenistan maçında Azerbaycan bayrakları toplatılmış, hatta kardeş Azerbaycanla diplomatik kriz yaşamıştık.
Yakın tarihten bir örnekle konuyu kapatayım. Celtic, Filistin bayrağı açan taraftarların kombinelerini iptal etti. Nedeni ise çok basit. UEFA'ya şirin gözüküp olası yaptırımlara maruz kalmamak.
Masumları katleden, orantısız güç kullanan, insanlık suçu işleyen hangi ülke olursa olsun mutlaka karşısında olmak zorundayız. FIFA ve UEFA, uygulayacağı yaptırımlarla Netanyahu hükümetinin elini bir nebze olsun zayıflatabilirdi. Özellikle savaşa karşı olan İsrailliler nazarında. Yapmadı, yapacak gibi de durmuyor.
Alman ilahiyatçı Martin Niemöller’in sözleriyle bitireyim:
“Naziler komünistler için geldiğinde sesimi çıkarmadım; çünkü komünist değildim.
Sosyal demokratları içeri tıktıklarında sesimi çıkarmadım; çünkü sosyal demokrat değildim.
Sonra sendikacılar için geldiler, bir şey söylemedim; çünkü sendikacı değildim.
Sonra Yahudiler için geldiler, sesimi çıkarmadım, çünkü Yahudi değildim.
Benim için geldiklerinde, sesini çıkaracak kimse kalmamıştı.”

İsrail Ortadoğu ülkesi olmasına rağmen uluslararası turnuvalarda Avrupa’da yer alıyor. Sizce de tuhaf değil mi? 1948 yılında kurulan İsrail, 1954’te Asya Futbol Konfederasyonu’na (AFC) üye oldu. Ancak bu durum bölge ülkelerinin direnişiyle karşılandı.
1958’de ülkenin dünya kupası elemelerine katılma hakkı olmasına rağmen tek bir maç dahi oynayamadı. Çünkü diğer ülkeler İsrail’le oynamayı reddetti. Böylelikle İsrail 1958 Dünya Kupası eleme aşamasını tek bir maç oynamadan kazanmasıyla sonuçlandı.
1974’te Kuveyt’in girişimiyle İsrail AFC’den çıkarıldı. 1994’te UEFA tam üyeliğini alan İsrail o tarihten bu yana Avrupa’da mücadele ediyor.

FIFA’nın 211 üyesi bulunuyor. FIFA bu yapısıyla 193 üyeli Birleşmiş Milletler’in önünde yer alıyor. Dünyanın en büyük örgütü unvanına sahip.
Başta yayın gelirleri olmak üzere gerek FIFA’nın gerekse UEFA’nın muazzam gelirleri mevcut.
Hal böyle olunca yolsuzluklar da kaçınılmaz oluyor.
UEFA eski Başkanı Platini, Katar'da düzenlenen 2022 Dünya Kupası'nın ihale sürecinde yapıldığı iddia edilen birtakım usulsüzlükler nedeniyle gözaltına alınmıştı. FIFA Etik Kurulu’nun, yolsuzluk ve rüşvet skandalı sonrası FIFA eski Başkanı Sepp Blatter ile Michel Platini'nin kurumun etik kurallarını ihlal ettiğine hükmetmesi ve seçimlerdeki şaibeler ise başka bir yazının konusu…
Katar’a 2022 Dünya Kupası’nı veren bu yapı, 2034 Dünya Kupası için Suudi Arabistan’ı seçerse hiç şaşırmak gerek. FIFA’nın etik kuralları, paranın olduğu yerde sadece yazılı metinlerden ibaret kalıyor.
FIFA ve UEFA icraatlarıyla ABD’den sonra İsrail’in en büyük destekçisi konumunda. ‘Futbolun patronları, zalimin ortakları’ desem abartmış olurum muyum?
Taktir, siz değerli okurların…"
Huseyin Suekinci,2,2025,Yakışmıyor,"Günlerdir heyecanla beklenen bir derbi daha geride kaldı.
Attığı başlıkla, SÖZCÜ internet spor servisi geceyi çok güzel özetledi:
Ne umduk ne bulduk!
Futbolun meyvesidir gol.
Golsüz biten maçlar, derbinin şanına yakışmıyor.
Maçtaydım.
Oynanan futbola, teknik konulara girecek değilim.
Söz konusu futbol olunca yaş ya da meslek fark etmiyor. Herkes işin uzmanı…
Benim derdim başka.
Şöyle;
Yüzlerce maç izledim, bir ilke şahit oldum pazartesi gecesi.
Mücadele başlamadan sahadaki yerini alan polis sayısı, deplasman taraftarının sayısından fazlaydı.

Maç sonundaki tablo daha da vahimdi.

Bu manzara Türkiye’nin spordaki imajına yakışmıyor.
52. dakikada, misafir takım tribünlerinde onlarca meşale yakıldı.
Sonra ne mi oldu?
Meşaleler, alt tribünde yer alan Galatasaraylı taraftarların üzerine atıldı. Bazıları filelere takılıp kendi taraftarlarının üstüne düşerken birkaçı, engeli aşmayı başardı.

Gecenin en çirkin anısıydı.
Ertesi gün İstanbul Valisi Davut Gül, Galatasaray-Fenerbahçe derbisinde taşkınlık yapan 71 kişi hakkında işlem yapıldığını açıkladı.
Umarım sadece işlem yapılmakla kalmaz, insan canını hiçe sayan her kimse en ağır cezaya çarptırılır.
Anderlecht Kulübü, UEFA Avrupa Ligi'nde Fenerbahçe ile yaptıkları play-off turu rövanş maçının durmasına neden olan taraftarların tespit edilerek men cezasına çaptırılacağını duyurmuştu ya hani.
Benzer bir açıklama da Fenerbahçe’den gelseydi keşke.
Sarı lacivertli yönetim açıklama hakkını, Jose Mourinho’nun basın toplantısındaki sözleri için kullandı. Ona da değineceğim fakat;
Haklı olarak bazılarınız şunu diyebilir;
‘Kardeşim bu statta sahaya rakı şişesi atıldı, rakı. Birinin kafasına gelse ölümüne sebep oldurdu’ diye.

Evet doğru. Galatasaray, Seyrantepe'ye taşınan Ali Sami Yen Spor Kompleksi’ndeki ilk mağlubiyetini aldığı maçta kaleci Volkan Demirel’e rakı şişesi atıldı. Kıl payı kurtuldu Volkan, aynı zamanda Milli Takımımızın da kalecisiydi.
Atan attığıyla kaldı, o zavallı hava bile atmıştır çevresindekilere.
Siz o gün, o şişeyi atanı, bugün meşale fırlatanı bulup en ağır şekilde cezalandırmazsanız bu olayların sonu kesilmez.
Bu konuda gerekli adımları atmak yerine susmayı tercih etmek Fenerbahçe’ye yakışmıyor.
Kural gereği, misafir takım taraftarları, ev sahibi takımın seyircileri stattan ayrıldıktan sonra terk edebiliyor tribünleri.
Basın toplantısından sonra stattan ayrıldım, bizzat şahit oldum. Stat yıkılıyor adeta.
Zelzeleden değil elbette.
Gülşen’in şarkı sözleri geldi aklıma.
Müzik son ses, bangır bangır
Ağzı bozuk şarkılar tuttum sana biraz ağır…
Misafir hadi misafirliğini bilmiyor, bari ev sahibi ev sahipliğinin hakkını verse.
Şimdi bazılarınız da şöyle serzenişte bulunabilir. Onlar da bize aynısı yapıyorlar diye.
Cevabım net: Herkes karakterinin gereğini yapar.
Misafirini sağır etmeye çalışmak Galatasaray yönetimine yakışmıyor.
Maç sırasında bir gözüm Okan Buruk’taydı.
Hakemlere parmak sallama huyundan vazgeçmediğine tanık oldum bir kez daha.

Maçtan sonra hakem için ‘Çok kötü yönetti’ sözlerine ne demeli peki.
Bazı spor yorumcularının Fatih Terim’i eleştirdiği için özür dilediğine, 'Beterin beteri varmış meğer' dediklerine şahitlik etti kulaklarım. 
‘Derbinin hakemi Slavko Vincic, maçı temiz yönetti’ noktasında ülke birleşse de Buruk’un sözleri akıl alır gibi değildi.
İşine geldiğinde 'yabancı hakem yönetsin' deyip bugün ise alınan karara isyan etmek, özetle hakkaniyeti yitirmek, 100 yıllık bir camianın hocasına yakışmıyor.
Fenerbahçe Teknik Direktörü Jose Mourinho’nun basın toplantısındaki ‘Maymun benzetmesi’ dünya basınında manşet oldu.
Niyeti ne olursa olsun Mourinho gibi deneyimli bir hocanın kullandığı ifadeler, kariyerine de çizgisine de yakışmıyor. 
Bitireyim.
Günlerce heyecanla bekleyip sonra hayal kırıklığına uğradığımız derbinin ardından demeçler havada uçuştu.
Galatasaray yönetimi Mourinho hakkında ‘Irkçı söylemleri nedeniyle savcılığa suç duyurusunda bulunacağını, UEFA ve FIFA nezdinde de şikayetçi olacağını’ duyurdu.
Fenerbahçe boş durur mu: Rekabeti saha dışına çıkarmak, gündemi değiştirmek ve manipüle etmek adına atılan bu aciz iftira ile ilgili hukuki haklarımızı kullanacağımızı kamuoyunun bilgisine sunuyoruz.
Kullanılan kaba sözler, karşı tarafı suçlayıcı dil, sonu gelmeyen ve çözüm çabasından uzak demeçler, ebedi dostlara yakışmıyor…
'Yanlış üslup doğru sözün celladıdır' der, İranlı Filozof Sadi-i Şirazi.
Cellatlık, insana hiç yakışmıyor!"
