Yazar,Ay,Sene,Baslik,Cumle
Yasin Yildirim,1,2024,Gereksiz panik,"Neredeyse tüm oyuncuları formda, rüzgarı arkasına almış bir Fenerbahçe. Maça da iştahlı bir başlangıç. Fred’in rakip savunmayı kıran uzun topu, Szymanski’nin Tadic’e bırakışı, onun da birinci sınıf tek pasında İrfan Can’ı bitirişi. Şiir gibi bir gol. Oyun kontrolünü eline alan ancak gaz pedalına da yüklenmeyen bir Fenerbahçe. Buna rağmen Dzeko’nun kaçırdığı iki net fırsat. Bosnalı ilk yarıda dikkatli olsaydı, maç bu noktaya gelmezdi. 
Markus Gisdol’ün gelişinden sonra bambaşka bir kimliğe büründü Samsunspor. Alman teknik adam oyunu kafasında iyi oynamış. Oyuncular da hiç panik yapmadı, özellikle ikinci yarıda dengeyi ciddi şekilde kurdu. Alim-Satka ve Bennasser’li geri üçlü sağlam durdu. Kısa süre önce Taylan’ın şutunu harika çıkaran Livakovic, 62’de Emre Kılınç’ın frikiğinde acemice bir gol yedi. 
Bu gol yenmezdi. Bir anlık hata, pahalıya mal oldu. Ama asıl sürprizi İsmail Kartal yaptı. Maçın bitmesine 20 dakika varken bir anda Fenerbahçe’nin sahadaki en önemli hücum üçlüsünü kenara aldı. Tamam elinde formda bir yedek kulübesi var ama gol lazımken golcü çıkması, üstüne Tadic ve İrfan gibi iki hat kıran, pas arası yapan oyuncunun da kenara gelmesi fazla cüretkardı. Oyun aklından bireyselliğe geçiş doğal olarak yerini gereksiz paniğe ve doldur boşalta bıraktı. Topu alan bir şeyler yapmaya çalıştı. İsmail Kartal’ın ezbere değişiklik yerine sistemsel değişikliğe gitmesi daha doğru olurdu. Dzeko ve Batshuayi bal gibi de birlikte oynardı. 
Fenerbahçe bu sezon hep makul yerlerde puan kayıpları yaşamıştı ilk kez sürpriz iki puan bıraktı. Üstelik rakibi Trabzon gibi bir deplasmana çıkarken."
Yasin Yildirim,1,2024,Enis yetti,"Trabzonspor bu sezon gerçekçi hedef olarak belirlediği Türkiye Kupası’nda son 16 biletini fazla zorlanmadan cebine koydu. Bakasetas, Abdülkadir, Trezeguet, Pepe, Onuachu...
Say say bitmeyen önemli eksiklerine rağmen yoluna devam etmeye çalışıyor bordo-mavililer. Abdullah Avcı’nın da doğal olarak fazla rotasyon şansı kalmıyordu. Manisa FK, TFF 1. Lig’de iddiası olmayan, lige tutunmaya çalışan bir ekip. Trabzonspor’un en büyük şansı da buydu. Ege temsilcisi rakibini hiç zorlayamadı. Böyle bir Trabzon’u bulmuşken en azından maça biraz daha ortak olmaları gerekirdi.
Trabzonspor önde baskıyla başladığı maçta golü de erken buldu. Hızlı pas trafiğinde topu Enis Destan’dan alan Fountas uzaktan çok şık bir vuruşla takımını öne geçirdi. Bu golden sadece 8 dakika sonra Korenica’nın frikik golü geldi.
Kosovalı futbolcunun vuruşu güzeldi ama Uğurcan Çakır kalitesindeki bir ismin o golü bence yememesi gerekirdi. İlk golde asisti yapan Enis Destan, bu kez Bardhi’nin korner vuruşunda şık bir kafa vuruşuyla tabelayı değiştirdi. Bu tarz vuruşları Fatih Tekke çok iyi yapardı, bana biraz onu anımsattı.
İkinci yarıda da Vişça’nın pasındaki tek vuruşla skoru belirledi ve gecenin yıldızı oldu. Altınordu fabrikasının Türk futboluna sunduğu Enis, fizik olarak biraz daha kendisini yukarı çekebilirse A Milli Takım için de önemli bir alternatif olur.
Henüz 21 yaşında ve önünde uzun yıllar var. Onuachu’nun yokluğu onun için büyük şans. Fazladan alacağı her dakikayı çok iyi değerlendirmeli. Türk futbolunun Enis gibi gençlere hem Euro 2024 hem de Euro 2032 için fazlasıyla ihtiyacı var."
Yasin Yildirim,1,2024,Bu nasıl Trabzon?,"TRABZONSPOR ilk hücumunda golü buldu hem de kronometre henüz 1 dakika 35. saniyeyi gösterirken. Visca’nın ortasında kaleciden seken topu Bardhi, Fountas’ın önüne bıraktı o da sol çaprazdan çok klas bir vuruşla ağlara gönderdi.
BU dakikadan sonra bitiş düdüğü olan 90+8. dakikaya kadar tek taraflı bir maç izledik. Trabzonspor savunan, Antalyaspor ise sürekli atak yapıp gol arayan taraftı. Evet bordo-mavili takımda Bakasetas, Abdülkadir, Pepe, Trezeguet ve Onuchu gibi çok önemli eksikler var. Bu 5 oyuncu Trabzonspor’un sezon boyu tüm hücum yükünü çeken isimler ama karşınızda da Real Madrid yok.
SERGEN Yalçın topa az temas ister, çabuk oyunu sever. Antalyaspor da bunu yapmaya çalıştı, topu sürekli kanatlara taşıdı, ciddi tehlikeler yarattı. İlk yarıda direk, Uğurcan ve uçarak çizgiye gelen Benkovic olmasaydı maç başka bir yere evrilirdi. İkinci yarıda gol geliyorum demişti, önce direk ardından Safuri’nin ortasında Jehezkel’in kafası 68’de skoru eşitledi. Normal şartlar altında skor 1-1’e gelince bizim alışkın olduğumuz Trabzonspor ne yapar? Gol arar. Ama Abdullah Avcı’nın takımı öyle yapmadı, yine rakibi savunmaya çalıştı. Bu nasıl Trabzon? İkinci yarıda 0 şutla maçı tamamlayan ve sadece iki kez rakip ceza sahasında topla buluşan Trabzonspor için bu 1 puan şükür sebebi olur."
Yasin Yildirim,1,2024,Derslik gol,"Türkiye'deki en temel sorunlardan biri Türk teknik direktörlerin yetersizliği ve vizyonsuzluğu. Sağ beki Ali Turap, sol beki Kazımcan olan çeyrek porsiyonluk Galatasaray’a karşı 5’li savunma ile çıkıyor mesela sahaya Bülent Uygun.
Önünde de 4’lü bir blok. Oynamaya niyeti olsa kazanacak Sivas ama bunun farkında olan cesur bir teknik direktörü yok. Sonuç ilk yarı 10 kişi savunma yapmanın karşılığında 2 direkten dönen top ve yenen bir gol.
Gol demişken ders niteliğindeydi. Kulüpleri yönetenler için zeminler kimin umurunda? İşte bir futbolcu menajerine verdiğin para kadar uğraşmadığın o zemin, ilk yarının sonunda sana golü yediriyor. Orası burası kalkmış, Kerem Demirbay’ın şutunda sekiyor olmayacak yerde kaleciyi yanıltıyor ve ağlarına gidiyor.
Keşke zemini bozuk olan takımlar her maç böyle goller yese. Galatasaray’ın elinde ne oynayacak ne de hamle yapacak kimse yok. Abdülkerim-Nelsson çabalayacak, Torreira sağa sola koşacak, Mertens de aklını kullanacak. O kadar. Zaha kıpırdamıyor, Kerem ve Halil sanki silah zoruyla sahada.
Kerem Demirbay iyi derken o da penaltı yaptırıyor. Şartlar böyle olunca da tek barutluk atımı oluyor Galatasaray’ın. Onlar da kaçınca iş şansa kalıyor. Şans da yanınızda olmayınca son dakikalarda alakasız bir top penaltı oluveriyor.
Biraz da hakemi konuş diyenler olabilir. Ortada hakem yok ki konuşalım!"
Yasin Yildirim,1,2024,Abdülcardi,"Dörtlü savunma, üçlü orta saha ve hücum hattı ilk kez birlikte oynuyor. Boey, Torreira, İcardi, Sanchez ve Ziyech gibi takımın yükünü çeken yıldızları da yok. Böyle olunca Galatasaray’ın tüm dengesi bozulmuş. Yedek kulübesinin yaş ortalaması 20.
Okan Buruk’un tek hamle oyuncusu Tete. 6 yerli oyuncuyla kurabiliyor ilk 11’i. Konyaspor da benzer şartlarda. Kalecisi ve en golcü oyuncusu kadro dışı. 18’lik Deniz kariyerinin ilk Süper Lig maçında kalede.
Bu sahada Galatasaray’ı yenen son hoca Hakan Keleş, yine aynı taktikle oynuyor. Takımı kompakt şekilde hareketli, ortayı iyi kapatıyor ve Galatasaray’ın hücum hattıyla temaslı oyunu tercih ediyor.
Galatasaray böyle bir takımı aşmak istiyorsa ya topu hızlandırmalı ya da oyuncuları hareketli olmalı ama bunların hiçbirini yapamıyor Galatasaray. İlk yarıda yakalanan birkaç atakta da genç Deniz başarılı oluyor.
Galatasaray'da oyun ciddiyeti bozulmayan bana göre iki oyuncu var: Biri Abdülkerim diğeri Kaan Ayhan. Abdülkerim baktı İcardi olmayınca kimsenin gol atmaya niyeti yok, çıktı hücuma müthiş bir vole ile duvarı yıktı. Fazlasıyla hak etmişti. Yetmedi ikinciyi de attı.
Ndombele'de umut yok, vakit kaybı. Halil de haliyle fizik olarak geriye gitmiş.  Bu şartlarda 3-0’lık galibiyet 3 puandan fazlası."
Yasin Yildirim,1,2024,"Atakan atladı, Trabzon attı","SALDIRI olayının ardından sessizliğe bürünmüş, ruhu da kaybolmuş Eryaman’ın. Kötü anılar eşliğinde maç yönetmek de maç oynamak da maç izlemek de zor geliyor.
PAS oyunu karakterindeki iki takım, benzer anlayıştaki iki hoca. Abdullah Avcı ve Emre Belözoğlu birbirini çok iyi tanıyor. Böyle olunca da kadro olarak daha iyi olan yani Trabzonspor istediklerini daha iyi yapıyor ilk yarıda.
ÖZELLİKLE Eren-Fountas kanadını kullanarak, soldan etkili gelen Trabzonspor bu ikiliyle gole yaklaştı.
PASLA çıkarken kaptırılan top başa beladır. 30. dakikada Ankaragücü hücuma çıkarken kaptırdığı topun bedelini ağır ödedi. Atakan kendini atmak yerine ayakta kalmaya çalışsa takımına golü yedirmeyecekti ama o alışkanlık haline getirdiği şeyi yaptı. Fountas’ın çevirdiği topta Bakasetas’ın şutu Visca’nın önünde kalınca, Boşnak yıldız sert şutuyla takımını öne geçirdi.
İKİNCİ yarıda çok fazla gömülen, rakibe çok fazla topla oynama şansı veren Trabzonspor vardı. Buna rağmen Ankaragücü bir-iki cılız pozisyon dışında Fırtına’yı zorlayamadı. Kısacası yalandan kurulan baskı sonuç vermedi. Trabzon ise kontra çıkışlar yapamadı. Bunda üretkenlikten uzak orta sahanın etkisi ve iki tarafın da fazla risk olmak istememesi etkiliydi. Oyunu zaman zaman riskler taşısa da Trabzonspor her şeye rağmen ayakta kaldı ve istediğini aldı.
KEYİFSİZ, oyun kalitesi düşük, pozisyon fakiri maçı yakaladığı şansı daha iyi kullanan konuk ekip kazandı."
Yasin Yildirim,1,2024,Liyakatsizliğin sonu,"RİYAD’DA yaşanan Süper Kupa fiyaskosunun nedenini anlamak için filmi biraz geriye sarmak şart.
MEHMET Büyükekşi, tarihin en zayıf yönetim kurulu ile Türk futbolunun büyük sorunlarını çözmek için tek aday olarak girdiği seçimde 335 oyun sadece 169’unu aldı. Daha o gün kabul görmediğini futbol ailesi ona belli etmişti.
BÜYÜKEKŞİ kimseye güvenmeyen bir yapıya sahip. O yüzden gelir gelmez TFF’nin kurumsal hafızası olan 100’e yakın çalışanla yolları ayırdı. Ardından hiçbiri futbolun içinden gelmeyen likayatsiz kişiler alakasız görevlere atandı. “Sadece 2 genel sekreter yardımcısı olacak. Bir tanesi futboldan, diğeri idari işlerden sorumlu olacak” dedi ve hepsi futbolun içinden gelen 7 genel sekreter yardımcısının görevine ya son verdi ya da titrini değiştirdi.
EREN Yeşilyurt gibi tartışmalı bir isim Genel Sekreter Yardımcısı olarak atandı. Üç ay önce TFF’ye zeytinyağı satmaya çalışan Yasemin Erdemir Güzeloğlu, TFF Kaynak Geliştirme ve Pazarlama Direktörü oldu. Futbolun F’sinden anlamayan, “Türkiye Kupası ne?” diyen Medine Arslan, Kurumsal İletişim Direktörü oldu.
GAZETECİLİK kökenli önemli iletişimcilerle yıllardır sağlanan sağlıklı iletişim ortamı bozuldu, dışarıdan iki PR ajansı ile anlaşıldı. Ajanslardan birine aylık 160 bin TL artı masraflar, diğerine 270 bin TL artı masraflar olmak üzere 500 bin TL’yi aşkın ödeme yapılıyor. Peki bu ajanslar ne yapıyor? İşin sadece etiket kısmı ile ilgilenip fatura kesiyor. Riyad seyahatinde harcama bütçesi 700 bin dolardı. Bu fazlasıyla aşıldı. Alakasız tipler, influencerlar da kafileye dahil edildi.
SÜPER Kupa’da bağıra bağıra gelen krize TFF’nin sürekli etiketle uğraşan idari ekibi ve PR’cıları “Nasıl olsa son dakikada hallederiz” diyerek bakınca, bomba kucaklarında patladı. Liyakatsizliğin sonu tarihi hüsranla bitti."
Yasin Yildirim,2,2024,Crespo neden gitti?,"Fenerbahçe Kadıköy’de bu kadar defansif bir orta saha ile mücadele edemez. Çok da formda olmayan İsmail Yüksek’le birlikte Milan’dan formsuz gelen Rade Krunic’i birlikte oynatmak ben bu takıma el freni çekiyorum demekti. Öyle de oldu. Ne defansif ne de ofansif anlamda ortada yok Krunic. Pas dağıtmıyor, takımı öne taşımıyor. O zaman bunları çok daha iyi yapan Crespo neden gitti? Krunic’i izledikten sonra Crespo’ya yazık olmuş.
Kasımpaşa ön alan baskısıyla Fenerbahçe’nin kolay çıkmaması için uğraş verdi. Çağlar’la birlikte takım boyu uzayan sarı-lacivertliler kısır orta saha ve hiç işlemeyen sağ kanatla birlikte ilk yarıda sezonun belki de en kötü futbolunu ortaya koydu. Bir Fred’in olmaması Fenerbahçe’yi bu kadar geri götüremez. Üstelik inanılmaz top kaybıyla oynayan bir Kasımpaşa rakipken. Cengiz de Fenerbahçe adına kayıplardaydı. Onun kanadından hiç gelemedi sarı-lacivertliler.
İkinci yarıda haliyle İsmail Kartal’ın gerekli değişiklikleri yapmasını beklerken, o aynı kadro ile sahada mücadele etme inadını sürdürdü. Rize maçında vurduğu neşteri bu kez vuramadı. Golü yemeyi bekledi ısrarla İsmail hoca. Kasımpaşa’nın golü de kornerden geldi. Büyük takımların bu kadar kolay kornerden gol yemeye de hakkı yok ayrıca. Mert Hakan’ın şahane golü takımı ateşleyemedi. Saman alevi gibi... Kurtarıcı olarak Serdar Dursun’a sarılmak da İsmail Kartal’ın artık kontrolü kaybetmeye başlamasının bir göstergesi. Üstüne bir de Batshuayi girdi iş tam olarak doldur boşalta dönüştü.
Fenerbahçe'nin oyun ve kenar yönetimi olarak kaybettiği gecede imdada 90+6’da VAR yetişti. Bu görüntüden penaltı çıkarmak özel bir çaba isterdi. Salı günü neler konuşuldu dinleyip göreceğiz."
Yasin Yildirim,2,2024,Alperen izlese Barış'ı kıskanır,"Barış Alper Yılmaz, ezber bozmaya devam ediyor. Bu çocuğun yapacaklarını  hesap etmek mümkün değil. Sağ kanatta başladı, karşısında Lima vardı. Çağdaş Atan onu sola atınca, Buruk da Kerem ve Barış’ın yerini değiştirdi.
Muslera’nın uzun topunda Ba’nın da hatasında dezavantajlı olmasına rağmen Lima’yı sırtına al, NBA’deki yıldızımız Alperen Şengün gibi önce sağa sonra sola çekip zorluk derecesi yüksek bir pozisyonda harika bir gol attı. Yetmedi Mertens’in golünde de araya giren isimdi, çalımlarını attı darbeyi de aldı.
Kendisini bıraksa penaltı alacaktı verdiği pas Mertens’in müthiş golünün hazırlayıcısı oldu. Eğer Galatasaray şampiyon olacaksa burada Barış Alper Yılmaz’a ayrılacak sayfa epey uzun olacak. Bu arada maçı da sağ bek olarak bitirdi!
İlk yarıda oyunu domine eden, Başakşehir’e nefes aldırmayan ve sistemini kusursuz şekilde sahaya yansıtan bir Galatasaray vardı. Davinson’un kusursuz oyunu, Mertens’in oyun zekası ve Barış Alper’in ezber bozan performansıyla zor geçmesi gereken maç kolaya döndü. Daha büyük fark da olabilirdi.
Sağ bek gelmedi Kaan Ayhan orada. Nelsson sakatlanıyor stopere geçiyor.  Buruk’un en büyük şansı elinde 2-3 görev adamının olması. İcardi’nin varlığı yetmiyor onu beslemek de gerekiyor.
İkinci yarıda Zaha ve Tete sahada kaldıkları sürece sadece gezmekle yetiniyor. Sözün özü görev adamları Galatasaray’ı taşımaya devam ediyor."
Yasin Yildirim,2,2024,Çöldeki vaha gibi,"Kadro ve oyuncu performansı olarak bu kadar kötü durumdaki bir Beşiktaş ve Trabzonspor’un maçını bu güne kadar izlememiştik herhalde. Ama Semih Kılıçsoy çöldeki vaha gibi çıktı bir anda.
İlk gol deki vuruşu birinci sınıftı. İkinci golünde ise en iyi zamanındaki Aguero’dan esintiler sundu. Topu alışı, üç kişi ile boğuşup ayakta kalması, son rasındaki klas bitirişi ile tribünleri ayağa kaldırdı. Henüz 18 yaşında olmasına rağmen böylesine bir patlayıcı güce sahip olması inanılmaz.
Euro 2024’te Türkiye’nin Avrupa futbol piyasasında taşları yerinden oynatacak bir oyuncusu var, orası kesin. Her kriz yeni bir fırsat doğurur. Aboubakar’ın kadro dışı kalması Semih gibi bir yıldızın doğmasına neden oldu. Zaten bizde planlı-programlı iş olmaz. Genelde şansa kalır. Serdar Topraktepe’yi de unutmamak lazım.
Beşiktaş ve Trabzonspor’un bu kadroları ile rekabetçi bir yarış içerisinde olmaları mümkün değil. Özellikle defans kurguları facia. Futbol iyi futbolcularla oynanır. Teknik direktör kalitesi de performansı yukarı çeker.
Trabzonspor maça daha iyi başlasa da bu bir yere kadar idare etti. Semih’in golünden önce hakem ve VAR’ın çok büyük bir hataya imza attığını da söylemek lazım. Trabzonspor lehine penaltı çıkabilecekken dönen topta gol oldu.
Sonuç olarak grogi durumdaki iki boksörün mücadelesi gibiydi. Beşiktaş ayakta kaldı, Trabzonspor yıldızları saydı."
Yasin Yildirim,3,2024,Pastanın çileği yok,"Avrupa futbolunun yükselen yıldızı Macaristan’a karşı 70 bin kişi önünde önemli bir sınav verdik. Ciddi eksiklere rağmen takımın ortaya koyduğu oyun, rakibe yaptığı baskı ve Macaristan’dan daha fazla rakip ceza sahasına girmemiz önemli artılarımız. Sorun ise bitiricilik. Burak Yılmaz ve Cenk Tosun sonrasında gerçek bir 9 numaraya sahip değiliz. Ne Enes Ünal ne Kenan Yıldız ne de ana rol biçseniz bile Semih Kılıçsoy ayağına bakabileceğiniz bir 9 numara değil. Yani baba bir golcümüz yok. Enes sakatlıktan çıktı ve bu sezon sadece 1 golü var. Kenan Yıldız yaşına göre olağanüstü fizik kalitesi ve oyun görüşü ile geleceğimiz olsa da bu sezon sadece 3 gol attı. Diğer 2005’li Semih Kılıçsoy’u ise oynamadan küstüreceğiz. Montella, her şartta Semih’i kazanmak zorunda çünkü onun bitiricilik yüzdesi diğer iki oyuncumuzdan daha yüksek.
Rakip 9, siz 30 kez ceza sahasına giriyor ama gol atamıyorsanız üzerinde çalışmanız gereken çok şey var demektir. Zaten Montella’nın bu oyun planında kanatlara forvetlerden daha çok iş düşecek gibi duruyor.
Her işi elimize yüzümüze bulaştırmada pek mahiriz. Semih Kılıçsoy sonuna kadar A Milli Takım’ı hak ediyor. Onu kadroya çağırıp, taktik idmana bile almadan Ümit Milli Takım’a yollamak durduk yere kriz çıkarmaktan ve oyuncuyu da küstürmekten başka bir şey değil. Buna ne gerek vardı? Macaristan maçında oynatmazsın, Avusturya maçında sahaya atarsın olur biter. Beşiktaş kanadından haklı olarak açıklamalar, ardından Pendik Stadı’nda milli takımın önüne geçen ayrışmalar. Değer miydi buna?
Arda Güler gözbebeğimiz, umudumuz ama onun vücut dilini hiç beğenmiyorum. Oyuna girdikten sonra sürekli kendisine oynamaya başladı. Real Madrid’de olduğu gibi. Futbol yıldızları sever ama modern futbol bir yere kadar sever. Yoksa kimse size iyi çalım atıyorsunuz diye formayı vermez. Arda bu şekilde takılmaya devam ederse EURO 2024 kadrosunda olmazsa ben şaşırmam."
Yasin Yildirim,3,2024,Özlenen takım,"Bu sıcağa kar dayanmaz sözünün karşılığıydı Trabzonspor-Karagümrük maçı. Öyle bir Fırtına çıktı ki karşımıza Karagümrük’ü attığı gole pişman etti.
Şota Arveladze ile pas ve geçiş oyunu oynamaya çalışan Karagümrük, dev forveti Markao’nun kornerdeki kafasıyla aradığı golü de buldu ama o kadar geriye yaslandı ki maç bu dakikadan sonra tek taraflı bir hal aldı. Hakkını yemeyelim ev sahibi ekibin oyunu da Karagümrük’ü çıkartmadı.
Maçın anahtarı Abdullah Avcı’nın Enis Destan yerine forvette Pepe’yi oynatmasıydı. Fildişili yıldız o kadar dinamik bir oyun oynadı ki sürekli gezdi, sürekli kovaladı. Klasik bir 9 numaradan çıkıp kanat, forvet, oyun kurucu özelliklerini forvete yansıtan Pepe, Trabzon’u oyun anlamında hem orta alanda hem hücumda bir kişi fazla oynattı. Ona iki kişi eşlik etti. Visca ve Trezeguet hem keyif veriyor hem de oynadıkları oyundan keyif alıyor. Hep doğru koşular hep doğru paslar atmanın ödülünü dünkü maçta aldılar. İlk golde Bardhi’nin şutunun Biraschi’ye çarpıp kaleciyi yanıltması, ikinci golde de Visca’nın ortasında aynı oyuncunun topu kendi ağlara yollaması Trabzonspor için şanstı ama bordo-mavililer bu şansı kendisi yarattı. Avcı’nın Enis-Umut Güneş değişikliği de pastanın çileği oldu. Onun girişiyle Fırtına vites yükseltti. Önce Pepe Trezeguet’ye ardından Trezeguet de Pepe’ye al da at dedi. Mısırlı futbolcu Trabzon’dan kopma noktasına gelen Umut Bozok’a da son dakikada nefis bir asist yaptı.
Kısacası Fırtına tempolu, coşkulu, topu paylaştığı ve sürekli doğruları yaptığı futboluyla şampiyon olduğu dönemdeki gibi bir takım izletti."
Yasin Yildirim,3,2024,Şaka gibi gol,"Kupada yarı finale çıkmak ve 3.’lük için mücadele edilen Beşiktaş’ın derbiyi kaybetmesi Trabzon’a yaramamış. Aşırı rehavet ve ciddiyetsizliği futbol kaldırmaz.
Uğurcan Çakır gibi bir kalecinin böyle bir konsantrasyon kaybına hiç hakkı yok. Denswil’in ileriye baktığını görmesine rağmen, takım arkadaşınla göz göze gelmeden ona doğru pas atarsan, rakip de gelir boş kaleye golü atar. Sen de şaka gibi bir gol yer dünya çapında mizah konusu olursun. Üstelik skor 1-0’ken
ve Trabzonspor oyunda dengeyi sağlamışken yapılan böyle bir hata maçın da kopmasına neden oldu. Kısacası Uğurcan maçı Alanya’ya hediye etti.
Fatih Tekke’nin gelişiyle oyun anlamında çıkışa geçen Alanyaspor maça etkili başlayan taraftı. Özellikle kanatları iyi kullanan ev sahibi golü de erken buldu. Balkovec’in Visca ve Meunier’le dans ederek kestiği ortada Uğurcan ilk hatasını yaptı, Oğuz Aydın da golü buldu. Genç futbolcu fırsatçılığının ödülünü ilk yarıda iki kez aldı. Biraz dikkatli olsa hat-trick de yapabilirdi.
Trabzonspor ilk yarıda 19 kez ceza sahasında topla buluşmasına ve 13 şut çekmesine rağmen golü bulamadı. Meunier etkili çıkışlarına bu maçta da devam etti. Yine Visca ve Trezeguet’in ayağına bakan Trabzonspor’da Enis’in tutuk futbolu da skor bulamama sorununa tuz biber ekti.
Uğurcan'ın üçüncü goldeki hatası da aklının yediği ikinci golde kalmasının bir sonucuydu. Kısacası rehavet Trabzonspor’a pahalıya patladı. Alanyaspor iyi futbolunun karşılığını haklı bir galibiyetle aldı."
Yasin Yildirim,3,2024,Sıklet farkı,"Fenerbahçe ile Hatayspor arasında öyle bir kalite ve sıklet farkı var ki sarı-lacivertliler adeta ikinci viteste oynadığı bir ilk yarıyla maçı kopardı. Ev sahibi ekibin bu kadro ve anlayışla Süper Lig’de kalması çok büyük bir başarı olur.
Ferdi'nin maçın hemen başında Szymanski’ye verdiği müthiş pası Polonyalının cömertçe harcaması makul karşılanabilir ama 16. dakikada Cengiz’in topuk pasını takip etmemesi ve topun korner direğine çarpıp oyunda kalması alışık olmadığımız bir durum. Ne oldu bu Szymanski’ye? Sezona Kevin De Bruyne gibi başlamıştı Yassine Benzia gibi devam ediyor. Nerede o her topa basan, rakibi ısıran, top ayağına geldi mi gol atan adam... Karşı karşıya pozisyonları bile bitiremez durumda.
37 yaşındaki Dzeko, kaptanlık bandının hakkını mücadelesiyle veriyor, yetmiyor bir de Osayi’ye soldan yaptığı asistle takımını rahatlatıyor. Yine soldan Tadic’in adrese teslim ortasında Cengiz alıştığımız sol kroşesini indirip maçı bitiriyor. Çağlar-Becao çok zorlanmasa da ilerleyen haftalar için biraz ağır kalırlar izlenimi verdi. Dünkü orta saha kurgusu da sadece Hatay’a yeter. Bunlar da gözden kaçmasın.
Kısacası kaliteli ayaklarla üflesen düşecek Hatay’ın başa çıkması mümkün değildi. Liderliği ile geçiren Fenerbahçe’ye bugünkü derbiyi rahat rahat izlemenin keyfi kaldı."
Yasin Yildirim,4,2024,Olmadı Enis,"Trabzonspor için bu sezon kupa çok şey demek. Onu da çok istediğini dün akşam gösterdi bordo-mavililer. Fountas’ın ters kanada attığı nefis pasta, Edin Visca’nın süper golü geldi. Karagümrük de Emre Mor ve Güven’le yoklamıştı kaleyi, golün geleceği belliydi, Mendes skoru eşitledi. İlk yarının sonlarına gelirken sağ stoper Mendy içeri ortaladı sol stoper Denswil sağ ayakla usta bir golcü vuruşu yaptı.
Buraya kadar her şey güzel giderken, Enis Destan’ın ilk yarının son dakikasında rakibine attığı yumruk işleri bozdu. Olmadı Enis, ne gerek vardı buna! Böylesine önemli bir maçta bir anlık öfkene hakim olamayıp takımını on kişi bırakmak, senin gibi sahada duruşu olan, umudumuz olan bir gence yakışmadı. Takım arkadaşların ekstra yükü kaldırdı ama maçın sonlarında zorlandı. Çok daha farklı bitebilecek bir maç 3-2 bitti.
İkinci yarıda on kişi kalan Trabzonspor’da bu kez roller değişti, Visca güzel bir asist yaptı Fountas bitirdi. Yunan futbolcunun dün akşamki performansı alkışı fazlasıyla hak etti. Onuachu da oyuna girdikten sonra dar alanda fizik kalitesini konuşturdu.
Taraftarlar, Nijeryalı golcüyü özlemiş. Rakip Karagümrük Paoletti ile umutlansa da Trabzonspor bir kişi eksik oynamasına rağmen ayakta kalmayı başardı. Ayrıca Fırtına, Visca, Fountas, Pepe ve Onuachu gibi yıldızlarıyla Türkiye Kupası’nın en büyük favorisi olduğu mesajını verdi."
